title,source,url,timestamp,cleaned_text,topics,sentiment
The 9 best places to eat in Silver Spring,Washington Post,https://www.washingtonpost.com/dc-md-va/2024/10/25/best-restaurants-silver-spring/,2024-10-25 10:36:56 UTC,the 9 best places to eat in silver spring,other,positive
Miss Manners: I’m hosting a party for a thing I hate,Washington Post,https://www.washingtonpost.com/advice/2024/10/25/miss-manners-party-friend-house/,2024-10-25 10:36:56 UTC,miss manners i m hosting a party for a thing i hate,other,negative
Md. police officer charged with attempted murder in shooting of unarmed man,Washington Post,https://www.washingtonpost.com/dc-md-va/2024/10/24/bowie-officer-charged-attempted-murder/,2024-10-25 10:36:56 UTC,md police officer charged with attempted murder in shooting of unarmed man,other,negative
The best places to see fall foliage in the D.C. area this weekend,Washington Post,https://www.washingtonpost.com/weather/2024/10/25/dc-maryland-virginia-fall-foliage/,2024-10-25 10:36:56 UTC,the best places to see fall foliage in the d c area this weekend,other,positive
Alexandria police release footage of moments leading up to fatal shooting,Washington Post,https://www.washingtonpost.com/dc-md-va/2024/10/24/alexandria-police-fatal-shooting-paul-behan/,2024-10-25 10:36:56 UTC,alexandria police release footage of moments leading up to fatal shooting,other,negative
"I rarely saw Georgia tailgaters in MAGA gear. This year, that changed.",Washington Post,https://www.washingtonpost.com/opinions/,2024-10-25 10:36:52 UTC,i rarely saw georgia tailgaters in maga gear this year that changed,other,neutral
The political history of Beyoncé,Washington Post,https://www.washingtonpost.com/style/,2024-10-25 10:36:52 UTC,the political history of beyonc,politics,positive
Federal judge bars Virginia from purging voters in election’s home stretch,Washington Post,https://www.washingtonpost.com/local/,2024-10-25 10:36:52 UTC,federal judge bars virginia from purging voters in election s home stretch,"politics,economy",negative
Reader critiques: The Post is dancing around the truth about Trump,Washington Post,https://www.washingtonpost.com/opinions/letters-to-the-editor/,2024-10-25 10:36:52 UTC,reader critiques the post is dancing around the truth about trump,politics,positive
"Harris Has Championed Family Policies. Now Trump Likes Them, Too.",New York Times,https://www.nytimes.com/2024/10/19/upshot/harris-trump-family-policies.html,2024-10-25 10:36:43 UTC,harris has championed family policies now trump likes them too,politics,positive
"Why Does This Building by the Subway Need 193 Parking Spots? (Yes, Exactly 193.)",New York Times,https://www.nytimes.com/interactive/2024/10/21/upshot/parking-mandates.html,2024-10-25 10:36:43 UTC,why does this building by the subway need 193 parking spots yes exactly 193,other,negative
State of the Race: A Close Race Gets Closer,New York Times,https://www.nytimes.com/2024/10/14/upshot/polling-trump-harris-election.html,2024-10-25 10:36:43 UTC,state of the race a close race gets closer,other,positive
Where Polls Can Mess Up (and What Pollsters Do About It),New York Times,https://www.nytimes.com/2024/10/14/us/elections/poll-problems-margin-of-error.html,2024-10-25 10:36:43 UTC,where polls can mess up and what pollsters do about it,politics,negative
"How Accurate, or Off-Target, Could the Polls Be This Year?",New York Times,https://www.nytimes.com/interactive/2024/10/17/us/politics/national-polls-election-results.html,2024-10-25 10:36:43 UTC,how accurate or off target could the polls be this year,politics,negative
The Evidence for a Big Youth Gender Gap and a Right Turn for Young Men,New York Times,https://www.nytimes.com/2024/10/18/upshot/polls-trump-harris-young-men.html,2024-10-25 10:36:43 UTC,the evidence for a big youth gender gap and a right turn for young men,other,positive
State of the Race: A Slight Shift Toward Trump but Still No Clear Favorite,New York Times,https://www.nytimes.com/2024/10/21/upshot/trump-harris-polls-election.html,2024-10-25 10:36:43 UTC,state of the race a slight shift toward trump but still no clear favorite,"politics,foreign_policy",negative
Why Is Trump Gaining With Black and Hispanic Voters?,New York Times,https://www.nytimes.com/2024/10/13/upshot/trump-black-hispanic-voters-harris.html,2024-10-25 10:36:43 UTC,why is trump gaining with black and hispanic voters,politics,negative
Harris May Be Catching Up on a Key Polling Question: Which Candidate Helps You?,New York Times,https://www.nytimes.com/2024/10/20/us/elections/trump-harris-policies-help-hurt.html,2024-10-25 10:36:43 UTC,harris may be catching up on a key polling question which candidate helps you,politics,negative
Trump’s Election Reversal Dreams Are Dead,New York Times,https://www.nytimes.com/2024/10/24/opinion/trump-election-outcome-law.html,2024-10-25 10:36:41 UTC,trump s election reversal dreams are dead,politics,negative
Don Jr. Is Making Plans,New York Times,https://www.nytimes.com/2024/10/25/opinion/donald-trump-jr-republican-party.html,2024-10-25 10:36:41 UTC,don jr is making plans,other,positive
"Elon Musk, Robert Kennedy and the Unconfirmables of a Second Trump Administration",New York Times,https://www.nytimes.com/2024/10/24/opinion/trump-elon-musk-robert-kennedy.html,2024-10-25 10:36:41 UTC,elon musk robert kennedy and the unconfirmables of a second trump administration,politics,positive
The Election Is Happening Too Soon,New York Times,https://www.nytimes.com/2024/10/24/opinion/polarization-harris-change.html,2024-10-25 10:36:41 UTC,the election is happening too soon,politics,negative
"It’s the Inflation, Stupid: Why the Working Class Wants Trump Back",New York Times,https://www.nytimes.com/2024/10/24/opinion/trump-election-inflation-working-class.html,2024-10-25 10:36:41 UTC,it s the inflation stupid why the working class wants trump back,"politics,economy",negative
Maggie Haberman on What an Unleashed Trump Might Do,New York Times,https://www.nytimes.com/2024/10/25/opinion/ezra-klein-podcast-maggie-haberman.html,2024-10-25 10:36:41 UTC,maggie haberman on what an unleashed trump might do,politics,positive
Republicans Assumed a Nebraska Senate Seat Was Safe. Then This Candidate Came Along.,New York Times,https://www.nytimes.com/2024/10/25/opinion/nebraska-senate-dan-osborn.html,2024-10-25 10:36:41 UTC,republicans assumed a nebraska senate seat was safe then this candidate came along,politics,positive
Beyond Trump vs. Harris: These Races Will Shape Our Future,New York Times,https://www.nytimes.com/2024/10/25/opinion/congress-races-tester-sheehy-hogan-osborn.html,2024-10-25 10:36:41 UTC,beyond trump vs harris these races will shape our future,politics,positive
Biden Has a Crucial Decision to Make on Ukraine,New York Times,https://www.nytimes.com/2024/10/25/opinion/ukraine-victory-plan-biden.html,2024-10-25 10:36:41 UTC,biden has a crucial decision to make on ukraine,politics,positive
The Only Guardrail Left Is Us,New York Times,https://www.nytimes.com/2024/10/25/opinion/trump-milley-kelly-esper-generals.html,2024-10-25 10:36:41 UTC,the only guardrail left is us,other,negative
Fatal Drug Overdoses Are Dropping. Not Everyone Is Spared.,New York Times,https://www.nytimes.com/2024/10/25/us/drug-overdoses-opioids-fentanyl.html,2024-10-25 10:36:36 UTC,fatal drug overdoses are dropping not everyone is spared,other,negative
Election 2024 Polls: Maine C.D. 2,New York Times,https://www.nytimes.com/interactive/2024/us/elections/polls-president-maine-2.html,2024-10-25 10:36:36 UTC,election 2024 polls maine c d 2,politics,positive
DeSantis Is Going All Out to Defeat Florida’s Abortion Ballot Question,New York Times,https://www.nytimes.com/2024/10/25/us/desantis-is-going-all-out-to-defeat-floridas-abortion-ballot-question.html,2024-10-25 10:36:36 UTC,desantis is going all out to defeat florida s abortion ballot question,politics,negative
Election 2024 Polls: Nebraska C.D. 2,New York Times,https://www.nytimes.com/interactive/2024/us/elections/polls-president-nebraska-2.html,2024-10-25 10:36:36 UTC,election 2024 polls nebraska c d 2,politics,neutral
Election 2024 Polls: New York,New York Times,https://www.nytimes.com/interactive/2024/us/elections/polls-president-new-york.html,2024-10-25 10:36:36 UTC,election 2024 polls,politics,positive
Election 2024 Polls: New Hampshire,New York Times,https://www.nytimes.com/interactive/2024/us/elections/polls-president-new-hampshire.html,2024-10-25 10:36:36 UTC,election 2024 polls hampshire,politics,positive
The ‘Greenest Governor’ Fights to Save a Landmark Climate Law,New York Times,https://www.nytimes.com/2024/10/25/us/washington-state-climate-initiative-2117.html,2024-10-25 10:36:36 UTC,the greenest governor fights to save a landmark climate law,other,neutral
HOUSE OF REPRESENTATIVES 12 Dems join GOP lawmakers to threaten UN funding over 'ongoing hostility' to Israel,Fox News Politics,https://www.foxnews.com/politics/12-dems-join-gop-lawmakers-threaten-un-funding-over-ongoing-hostility-israel,2024-10-25 10:24:21 UTC,house of representatives 12 dems join gop lawmakers to threaten un funding over ongoing hostility to israel,other,negative
CRIME Socialist group in AOC district blasts police crackdown in her crime-ridden area,Fox News Politics,https://www.foxnews.com/us/socialist-group-aoc-district-blasts-police-crackdown-her-crime-ridden-area,2024-10-25 10:24:21 UTC,crime socialist group in aoc district blasts police crackdown in her crime ridden area,other,negative
Follow CNN Politics,CNN,https://facebook.com/cnnpolitics,2024-10-25 10:24:11 UTC,follow cnn politics,other,neutral
Hillary Clinton says Trump's Madison Square Garden event is a 'Nazi rally',telegraph.co.uk,https://www.telegraph.co.uk/us/politics/2024/10/25/hillary-clinton-trump-madison-square-garden-nazi-rally/,2024-10-25 10:23:23 UTC,hillary clinton trump s madison square garden event is a nazi rally,politics,negative
'Washingon Post' won't endorse in White House race for first time since 1980s,npr.org,https://www.npr.org/2024/10/25/nx-s1-5165353/washingon-post-presidential-endorsement-trump-harris,2024-10-25 10:01:13 UTC,washingon post won t endorse in white house race for first time since 1980s,other,negative
Pentagon Pentagon denies false claim that Biden-Harris admin authorized troops to use force against Americans,Fox News Politics,https://www.foxnews.com/politics/pentagon-denies-false-claim-biden-harris-admin-authorized-troops-use-force-against-americans,2024-10-25 09:54:48 UTC,pentagon pentagon denies false claim that biden harris admin authorized troops to use force against americans,politics,negative
POLITICS Former Republican Rep. Fred Upton says he's 'proud' he voted for Kamala Harris,Fox News Politics,https://www.foxnews.com/politics/former-republican-rep-fred-upton-says-hes-proud-he-voted-kamala-harris,2024-10-25 09:54:48 UTC,politics former republican rep fred upton he s proud he voted for kamala harris,politics,positive
Border security Caravan descending on border could preview migrant rush to sneak into US if Trump wins election,Fox News Politics,https://www.foxnews.com/politics/caravan-descending-border-could-preview-migrant-rush-sneak-us-trump-wins-election,2024-10-25 09:54:48 UTC,border security caravan descending on border could preview migrant rush to sneak into us if trump wins election,politics,negative
NEWT GINGRICH: House Speaker Mike Johnson deserves reelection,Fox News Politics,https://www.foxnews.com/opinion/newt-gingrich-house-speaker-mike-johnson-deserves-reelection,2024-10-25 09:54:48 UTC,newt gingrich house speaker mike johnson deserves reelection,politics,negative
Federal judge halts Virginia’s pre-election voter roll purge aimed at suspected noncitizens,CNN,https://www.cnn.com/2024/10/25/politics/virginia-voter-purge-noncitizens/index.html,2024-10-25 09:54:28 UTC,federal judge halts virginia s pre election voter roll purge aimed at suspected noncitizens,"politics,economy",negative
"Polls Trump, Harris dead even in national poll, with just one in four saying country headed in right direction",Fox News Politics,https://www.foxnews.com/politics/trump-harris-dead-even-national-poll-just-1-4-saying-country-headed-right-direction,2024-10-25 09:44:42 UTC,polls trump harris dead even in national poll with just one in four saying country headed in right direction,politics,negative
Secret Iranian missile storage site exposed by anti-regime group amid mounting regional tensions,Fox News Politics,https://www.foxnews.com/world/secret-iranian-missile-storage-site-exposed-anti-regime-group-amid-mounting-regional-tensions,2024-10-25 09:44:42 UTC,secret iranian missile storage site exposed by anti regime group amid mounting regional tensions,other,negative
"If Trump wins, he will need a Congress with common sense",Fox News Politics,https://www.foxnews.com/opinion/trump-wins-need-congress-common-sense,2024-10-25 09:44:42 UTC,if trump wins he will need a congress with common sense,politics,negative
"Trump lawyers move to dismiss Jack Smith 2020 election charges, claim he was unlawfully appointed",Fox News Politics,https://www.foxnews.com/politics/trump-lawyers-move-dismiss-jack-smith-2020-election-charges-claim-he-unlawfully-appointed,2024-10-25 09:44:42 UTC,trump lawyers move to dismiss jack smith 2020 election charges claim he was unlawfully appointed,politics,negative
"The Harris campaign does not want to be playing ‘catch-up’ right now, highlights Katie Pavlich",Fox News Politics,https://www.foxnews.com/video/6363714246112,2024-10-25 09:44:42 UTC,the harris campaign does not want to be playing catch up right now highlights katie pavlich,politics,negative
96 days: Kamala Harris has yet to do formal press conference since emerging as Democratic nominee,Fox News Politics,https://www.foxnews.com/media/96-days-kamala-harris-has-yet-do-formal-press-conference-since-emerging-democratic-nominee,2024-10-25 09:44:42 UTC,96 days kamala harris has yet to do formal press conference since emerging as democratic nominee,politics,negative
Harris campaigns with Bruce Springsteen while her 'Boss' is absent from campaign trail,Fox News Politics,https://www.foxnews.com/video/6363718718112,2024-10-25 09:44:42 UTC,harris campaigns with bruce springsteen while her boss is absent from campaign trail,politics,negative
Republicans Vulnerable NY Republican blasts Dem challenger's progressive endorsement after moderate showing at debate,Fox News Politics,https://www.foxnews.com/politics/vulnerable-ny-republican-blasts-dem-challengers-progressive-endorsement-after-moderate-showing-debate,2024-10-25 09:44:42 UTC,republicans vulnerable ny republican blasts dem challenger s progressive endorsement after moderate showing at debate,politics,negative
"Coming up on Friday, Oct. 25 edition of 'Special Report'",Fox News Politics,https://www.foxnews.com/video/6363714764112,2024-10-25 09:44:42 UTC,coming up on friday oct 25 edition of special report,other,negative
SEAN HANNITY: Democrats have failed Americans,Fox News Politics,https://www.foxnews.com/media/sean-hannity-democrats-have-failed-americans,2024-10-25 09:44:42 UTC,sean hannity democrats have failed americans,politics,negative
Opinion The Post endorses Donald Trump for president — the clear choice for a better future,Fox News Politics,https://www.foxnews.com/opinion/post-endorses-donald-trump-president-clear-choice-better-future,2024-10-25 09:44:42 UTC,the post endorses donald trump for president the clear choice for a better future,politics,positive
"Mel Gibson backs Trump for president, says Harris has 'the IQ of a fence post'",Fox News Politics,https://www.foxnews.com/media/mel-gibson-backs-trump-president-says-harris-has-the-iq-fence-post,2024-10-25 09:44:42 UTC,mel gibson backs trump for president harris has the iq of a fence post,politics,negative
"POLITICS US judge orders Virginia to restore voters removed from rolls, restoring access for thousands",Fox News Politics,https://www.foxnews.com/politics/us-judge-orders-virginia-restore-voters-removed-from-rolls-restoring-access-thousands,2024-10-25 09:44:42 UTC,politics us judge orders virginia to restore voters removed from rolls restoring access for thousands,politics,positive
"Polls Trump, Harris dead even in national poll, with just 1 in 4 saying country headed in right direction",Fox News Politics,https://www.foxnews.com/politics/trump-harris-dead-even-national-poll-just-1-4-saying-country-headed-right-direction,2024-10-25 09:44:42 UTC,polls trump harris dead even in national poll with just 1 in 4 saying country headed in right direction,politics,negative
The Post endorses Donald Trump for president — the clear choice for a better future,Fox News Politics,https://www.foxnews.com/opinion/post-endorses-donald-trump-president-clear-choice-better-future,2024-10-25 09:44:42 UTC,the post endorses donald trump for president the clear choice for a better future,politics,positive
Harvard professors argue that America needs a 'militant democracy' to stop Trump,Fox News Politics,https://www.foxnews.com/media/harvard-professors-argue-america-needs-militant-democracy-stop-trump,2024-10-25 09:44:42 UTC,harvard professors argue that america needs a militant democracy to stop trump,politics,negative
RFK Jr urges Catholics to vote for Trump in new ad,Fox News Politics,https://www.foxnews.com/politics/rfk-jr-urges-catholics-vote-trump-new-ad,2024-10-25 09:44:42 UTC,rfk jr urges catholics to vote for trump in ad,politics,negative
CNN's Jake Tapper admits his Democratic friends are 'terrified' Harris isn't 'closing the deal',Fox News Politics,https://www.foxnews.com/media/cnns-jake-tapper-admits-democratic-friends-terrified-harris-isnt-closing-deal,2024-10-25 09:44:42 UTC,cnn s jake tapper admits his democratic friends are terrified harris isn t closing the deal,politics,negative
"Harris campaign resorts to dark, anti-Trump rhetoric in final days",Fox News Politics,https://www.foxnews.com/video/6363746481112,2024-10-25 09:44:42 UTC,harris campaign resorts to dark anti trump rhetoric in final days,politics,negative
Former governors call for respect of the election process: 'No need to act like children',Fox News Politics,https://www.foxnews.com/video/6363715627112,2024-10-25 09:44:42 UTC,former governors call for respect of the election process no need to act like children,politics,positive
Katie Couric pushes back on Charlamagne calling Kamala Harris 'authentic',Fox News Politics,https://www.foxnews.com/media/katie-couric-pushes-back-charlamagne-calling-kamala-harris-authentic,2024-10-25 09:44:42 UTC,katie couric pushes back on charlamagne calling kamala harris authentic,politics,positive
"Supreme Court 'Ideological balance': Supreme Court's conservative majority to stay no matter who wins election, experts say",Fox News Politics,https://www.foxnews.com/politics/ideological-balance-supreme-courts-conservative-majority-stay-no-matter-who-wins-election-experts-say,2024-10-25 09:44:42 UTC,supreme court ideological balance supreme court s conservative majority to stay no matter who wins election experts say,politics,negative
HOUSE OF REPRESENTATIVES 11 Dems join GOP lawmakers to threaten UN funding over 'ongoing hostility' to Israel,Fox News Politics,https://www.foxnews.com/politics/11-dems-join-gop-lawmakers-threaten-un-funding-over-ongoing-hostility-israel,2024-10-25 09:44:42 UTC,house of representatives 11 dems join gop lawmakers to threaten un funding over ongoing hostility to israel,other,negative
Elections Newsletter Fox News Politics: Nearly 1 million migrants staying 'indefinitely',Fox News Politics,https://www.foxnews.com/politics/fox-news-politics-nearly-1-million-migrants-staying-indefinitely,2024-10-25 09:44:42 UTC,elections newsletter fox news politics nearly 1 million migrants staying indefinitely,politics,negative
Hillary Clinton accuses Trump of 'reenacting' infamous Nazi rally at Madison Square Garden: We can't ignore it,Fox News Politics,https://www.foxnews.com/media/hillary-clinton-accuses-trump-reenacting-infamous-nazi-rally-madison-square-garden,2024-10-25 09:44:42 UTC,hillary clinton accuses trump of reenacting infamous nazi rally at madison square garden we can t ignore it,politics,negative
"POLITICS 'Ill-fated effort': McConnell was 'furious' at Rick Scott's 2022 leader bid, book says",Fox News Politics,https://www.foxnews.com/politics/ill-fated-effort-mcconnell-furious-rick-scotts-2022-leader-bid-book-says,2024-10-25 09:44:42 UTC,politics ill fated effort mcconnell was furious at rick scott s 2022 leader bid book,other,negative
"Elon Musk keeps up pro-Trump spending spree as Harris continues to dominate money race, new filings show",CNN,https://www.cnn.com/2024/10/25/politics/fundraising-takeaways-elon-musk-harris-trump/index.html,2024-10-25 09:44:31 UTC,elon musk keeps up pro trump spending spree as harris continues to dominate money race filings show,politics,positive
Harris to deliver address on reproductive freedom at Texas rally featuring Beyoncé,CNN,https://www.cnn.com/2024/10/25/politics/harris-reproductive-rights-texas-beyonce/index.html,2024-10-25 09:44:31 UTC,harris to deliver address on reproductive freedom at texas rally featuring beyonc,politics,positive
Election workers prepare to handle ‘concerning list’ of poll watchers who could disrupt the vote,CNN,https://www.cnn.com/2024/10/25/politics/poll-watchers-concerns/index.html,2024-10-25 09:44:31 UTC,election workers prepare to handle concerning list of poll watchers who could disrupt the vote,politics,negative
"In race for Congress, Democrats burn through cash while outraising Republicans in final election sprint, new filings show",CNN,https://www.cnn.com/2024/10/25/politics/campaign-fundraising-house-senate/index.html,2024-10-25 09:44:31 UTC,in race for congress democrats burn through cash while outraising republicans in final election sprint filings show,politics,negative
Meet the Pennsylvania nuns falsely accused of voter fraud,CNN,https://www.cnn.com/2024/10/25/politics/benedictine-sisters-of-erie-pennsylvania-election-fraud-viral/index.html,2024-10-25 09:44:31 UTC,meet the pennsylvania nuns falsely accused of voter fraud,politics,neutral
Celebrities bringing star power to campaign trail for Harris and Trump,Washington Post,https://www.washingtonpost.com/politics/2024/10/25/celebrities-trump-harris-campaign-trail/,2024-10-25 09:44:28 UTC,celebrities bringing star power to campaign trail for harris and trump,politics,positive
Senate Democrats’ last hope: Trump voters willing to split their ticket,Washington Post,https://www.washingtonpost.com/elections/,2024-10-25 09:44:28 UTC,senate democrats last hope trump voters willing to split their ticket,politics,negative
Why Bernie Sanders is running,Washington Post,https://www.washingtonpost.com/elections/,2024-10-25 09:44:28 UTC,why bernie sanders is running,other,negative
What does 2020 swing-state early voting tell us about 2024? Not much.,Washington Post,https://www.washingtonpost.com/politics/2024/10/25/early-voting-swing-states/,2024-10-25 09:44:28 UTC,what does 2020 swing state early voting tell us about 2024 not much,other,negative
Elon Musk’s pro-Trump PAC awards more $1 million prizes despite DOJ warning,Washington Post,https://www.washingtonpost.com/elections/,2024-10-25 09:44:28 UTC,elon musk s pro trump pac awards more 1 million prizes despite doj warning,"politics,foreign_policy",positive
"In Wisconsin county, undecided voters reflect unease with Trump, Harris",Washington Post,https://www.washingtonpost.com/politics/,2024-10-25 09:44:28 UTC,in wisconsin county undecided voters reflect unease with trump harris,politics,negative
Podcaster Joe Rogan will interview Trump. Here’s what to know.,Washington Post,https://www.washingtonpost.com/elections/2024/10/25/trump-joe-rogan-podcast-interview/,2024-10-25 09:44:28 UTC,podcaster joe rogan will interview trump here s what to know,politics,positive
"Election 2024 live updates: Harris, Trump to converge on Texas to highlight competing issues",Washington Post,https://www.washingtonpost.com/elections/,2024-10-25 09:44:28 UTC,election 2024 live updates harris trump to converge on texas to highlight competing issues,politics,positive
Only a third of Trump supporters say they’ll accept a narrow loss,Washington Post,https://www.washingtonpost.com/politics/2024/10/25/only-third-trump-supporters-say-theyll-accept-narrow-loss/,2024-10-25 09:44:28 UTC,only a third of trump supporters say they ll accept a narrow loss,politics,negative
"How Trump talks: Abrupt shifts, profane insults, confusing sentences",Washington Post,https://www.washingtonpost.com/elections/,2024-10-25 09:44:28 UTC,how trump talks abrupt shifts profane insults confusing sentences,politics,negative
Late Lawsuit Could Shape Political Ad Wars in Final Days of Campaign,New York Times,https://www.nytimes.com/2024/10/25/us/politics/political-ad-lawsuit.html,2024-10-25 09:44:24 UTC,late lawsuit could shape political ad wars in final days of campaign,"politics,foreign_policy",negative
Why Harris (With Beyoncé in Tow) Is Heading to Solidly Red Texas,New York Times,https://www.nytimes.com/2024/10/25/us/politics/harris-beyonce-houston-texas.html,2024-10-25 09:44:24 UTC,why harris with beyonc in tow is heading to solidly red texas,politics,positive
Betting Markets Favor Trump. But Their Record of Accuracy Is Mixed.,New York Times,https://www.nytimes.com/2024/10/25/us/elections/prediction-markets-election-polls.html,2024-10-25 09:44:24 UTC,betting markets favor trump but their record of accuracy is mixed,"politics,economy",negative
Could Trump Win the Popular Vote but Lose the Electoral College?,New York Times,https://www.nytimes.com/2024/10/25/upshot/poll-trump-harris-election.html,2024-10-25 09:44:24 UTC,could trump win the popular vote but lose the electoral college,politics,negative
