title,source,url,timestamp,cleaned_text,topics,sentiment
Follow the sprint to Election Day,CNN,https://www.cnn.com/politics/election-2024-key-dates-dg/index.html,2024-10-24 23:42:47 UTC,follow the sprint to election day,politics,positive
What’s the latest news about the Trump-Harris race? It depends on who you ask,CNN,https://www.cnn.com/2024/09/29/politics/breakthrough-polling-project-trump-harris-springfield/index.html,2024-10-24 23:42:47 UTC,what s the latest news about the trump harris race it depends on who you ask,politics,negative
Harris’ border visit and economy speech capture attention as warning signs emerge for campaign,CNN,https://www.cnn.com/2024/10/06/politics/breakthrough-polling-project-harris-lie/index.html,2024-10-24 23:42:47 UTC,harris border visit and economy speech capture attention as warning signs emerge for campaign,"politics,economy,foreign_policy",positive
Experience the iconic Magic Wall,CNN,https://www.cnn.com/interactive/2024/magic-wall/,2024-10-24 23:42:47 UTC,experience the iconic magic wall,other,positive
Obama says White nationalists ‘explicitly rally around Trump’,CNN,https://www.cnn.com/2024/10/23/politics/obama-trump-white-nationalists-fundraiser/index.html,2024-10-24 23:42:47 UTC,obama white nationalists explicitly rally around trump,politics,negative
Fact check: Debunking Trump’s October lying spree about immigration,CNN,https://www.cnn.com/2024/10/18/politics/fact-check-trump-october-immigration/index.html,2024-10-24 23:42:47 UTC,fact check debunking trump s october lying spree about immigration,politics,negative
These are the states where abortion rights will be on the ballot in November,CNN,https://www.cnn.com/2024/04/28/politics/state-abortion-ballot-measure-vote-dg/index.html,2024-10-24 23:42:47 UTC,these are the states where abortion rights will be on the ballot in november,politics,positive
Trump’s mass deportation plans would be costly. Here’s why,CNN,https://www.cnn.com/2024/10/19/politics/trump-mass-deportation-cost-cec/index.html,2024-10-24 23:42:47 UTC,trump s mass deportation plans would be costly here s why,politics,negative
Get all the important election dates you need to know,CNN,https://www.cnn.com/election/2024/calendar,2024-10-24 23:42:47 UTC,get all the important election dates you need to know,politics,neutral
Here’s a breakdown of all the 2024 presidential candidates,CNN,https://www.cnn.com/interactive/2024/politics/presidential-candidates-dg/?index.html,2024-10-24 23:42:47 UTC,here s a breakdown of all the 2024 presidential candidates,other,neutral
Virginia city’s preelection fight over certification shows how local procedures have become a flashpoint,CNN,https://www.cnn.com/2024/10/22/politics/virginia-city-election-certification/index.html,2024-10-24 23:42:47 UTC,virginia city s preelection fight over certification shows how local procedures have become a flashpoint,politics,neutral
Which states determined the 2020 election,CNN,https://www.cnn.com/election/2020/results/president,2024-10-24 23:42:47 UTC,which states determined the 2020 election,politics,positive
Fact check: Vance falsely claims Trump did not ‘go after his political opponents’ as president,CNN,https://www.cnn.com/2024/10/15/politics/fact-check-vance-trump-political-opponents/index.html,2024-10-24 23:42:47 UTC,fact check vance falsely claims trump did not go after his political opponents as president,politics,negative
The Rust Belt manufacturing collapse devastated their communities. Two men explain who they’re supporting for president,CNN,https://www.cnn.com/2024/09/26/politics/manufacturing-jobs-trump-harris-economy/index.html,2024-10-24 23:42:47 UTC,the rust belt manufacturing collapse devastated their communities two men explain who they re supporting for president,other,negative
Zoom in on the Democratic national map,CNN,https://www.cnn.com/election/2024/primaries-and-caucuses/results/democratic-party/president,2024-10-24 23:42:47 UTC,zoom in on the democratic national map,politics,positive
Promises Donald Trump has made so far in his campaign for a second term,CNN,https://www.cnn.com/interactive/2024/04/politics/trump-campaign-promises-dg/,2024-10-24 23:42:47 UTC,promises donald trump has made so far in his campaign for a second term,politics,positive
Economic worries boost Trump’s Hispanic support in battleground Nevada,CNN,https://www.cnn.com/2024/09/17/politics/nevada-hispanic-voters-trump-harris/index.html,2024-10-24 23:42:47 UTC,economic worries boost trump s hispanic support in battleground nevada,"politics,economy",positive
Fact check: What Trump keeps getting wrong about ‘paper ballots’,CNN,https://www.cnn.com/2024/10/15/politics/fact-check-trump-paper-ballots/index.html,2024-10-24 23:42:47 UTC,fact check what trump keeps getting wrong about paper ballots,politics,negative
"Elon Musk and other billionaires invest staggering sums into electing Trump, plus other takeaways from third-quarter filings",CNN,https://www.cnn.com/2024/10/16/politics/fundraising-takeaways-elon-musk-billionaires-trump/index.html,2024-10-24 23:42:47 UTC,elon musk and other billionaires invest staggering sums into electing trump plus other takeaways from third quarter filings,politics,neutral
Promises Kamala Harris has made so far in her campaign,CNN,https://www.cnn.com/interactive/2024/08/politics/kamala-harris-key-issues-dg/,2024-10-24 23:42:47 UTC,promises kamala harris has made so far in her campaign,politics,positive
Harris and Trump’s final sprint to Election Day,CNN,https://www.cnn.com/politics/live-news/harris-trump-election-10-24-24/index.html,2024-10-24 23:42:47 UTC,harris and trump s final sprint to election day,politics,positive
The electorate is changing. Here’s what that means for Trump and Harris,CNN,https://www.cnn.com/2024/10/22/politics/changing-electorate-trump-harris-analysis/index.html,2024-10-24 23:42:44 UTC,the electorate is changing here s what that means for trump and harris,politics,positive
Democratic lawmaker faces GOP challenge over voter registration,CNN,https://www.cnn.com/2024/10/24/politics/sykes-voter-challenge-congress/index.html,2024-10-24 23:42:44 UTC,democratic lawmaker faces gop challenge over voter registration,politics,negative
Federal appeals court could rule soon on Biden’s student loan repayment plan. Here’s what borrowers need to know,CNN,https://www.cnn.com/2024/10/24/politics/student-loans-save-plan-court/index.html,2024-10-24 23:42:44 UTC,federal appeals court could rule soon on biden s student loan repayment plan here s what borrowers need to know,"politics,economy",negative
Milwaukee’s Black voters expose cracks in Democratic foundation for Harris,CNN,https://www.cnn.com/2024/10/11/politics/milwaukee-black-voters-kamala-harris/index.html,2024-10-24 23:42:44 UTC,milwaukee s black voters expose cracks in democratic foundation for harris,politics,negative
Beyoncé to appear alongside Harris at Houston rally,CNN,https://www.cnn.com/2024/10/24/politics/beyonce-kamala-harris-rally/index.html,2024-10-24 23:42:44 UTC,beyonc to appear alongside harris at houston rally,politics,positive
Pennsylvania Supreme Court says those whose mail ballots are rejected for defects should be allowed to vote provisionally,CNN,https://www.cnn.com/2024/10/23/politics/pennsylvania-supreme-court-mail-ballot-provisional/index.html,2024-10-24 23:42:44 UTC,pennsylvania supreme court those whose mail ballots are rejected for defects should be allowed to vote provisionally,politics,negative
Harris and Obama use first joint campaign event to rally voters in battleground Georgia,CNN,https://www.cnn.com/2024/10/24/politics/obama-harris-campaign-appearance-election/index.html,2024-10-24 23:42:44 UTC,harris and obama use first joint campaign event to rally voters in battleground georgia,politics,positive
Fact-checking Harris’ CNN town hall in Pennsylvania,CNN,https://www.cnn.com/2024/10/23/politics/fact-check-harris-town-hall/index.html,2024-10-24 23:42:44 UTC,fact checking harris cnn town hall in pennsylvania,politics,neutral
2024 elections glossary,CNN,https://cnn.it/48dUqAp,2024-10-24 23:42:44 UTC,2024 elections glossary,politics,positive
Takeaways from Kamala Harris’ CNN town hall,CNN,https://www.cnn.com/2024/10/23/politics/takeaways-kamala-harris-town-hall/index.html,2024-10-24 23:42:44 UTC,takeaways from kamala harris cnn town hall,politics,positive
Trump says he’d fire Jack Smith quickly if he wins another term in office,CNN,https://www.cnn.com/2024/10/24/politics/donald-trump-jack-smith/index.html,2024-10-24 23:42:44 UTC,trump he d fire jack smith quickly if he wins another term in office,politics,negative
FBI zeroing in on where leaked US intel documents were printed,CNN,https://www.cnn.com/2024/10/24/politics/fbi-zeroing-leaked-us-intel-documents-printed/index.html,2024-10-24 23:42:44 UTC,fbi zeroing in on where leaked us intel documents were printed,other,negative
Fascism and food prices: the issues driving the last 12 days of the election,CNN,https://www.cnn.com/2024/10/24/politics/harris-fascism-grocery-prices-analysis/index.html,2024-10-24 23:42:44 UTC,fascism and food prices the issues driving the last 12 days of the election,politics,negative
"Hillary Clinton says Trump is ‘more unhinged, more unstable’ than in 2016",CNN,https://www.cnn.com/2024/10/25/politics/hillary-clinton-trump-harris-election/index.html,2024-10-24 23:42:44 UTC,hillary clinton trump is more unhinged more unstable than in 2016,politics,negative
"County judge strikes down Ohio abortion ban, citing voter-approved reproductive rights amendment",CNN,https://www.cnn.com/2024/10/24/politics/ohio-abortion-ban-amendment/index.html,2024-10-24 23:42:44 UTC,county judge strikes down ohio abortion ban citing voter approved reproductive rights amendment,politics,negative
McConnell says ‘MAGA movement is completely wrong’ and Reagan ‘wouldn’t recognize’ Trump’s GOP,CNN,https://www.cnn.com/2024/10/23/politics/mcconnell-trump-gop-new-book/index.html,2024-10-24 23:42:44 UTC,mcconnell maga movement is completely wrong and reagan wouldn t recognize trump s gop,politics,negative
"Iranian hackers have probed US election websites for vulnerabilities, Microsoft says",CNN,https://www.cnn.com/2024/10/23/politics/iranian-hackers-probed-us-election-websites/index.html,2024-10-24 23:42:44 UTC,iranian hackers have probed us election websites for vulnerabilities microsoft,politics,negative
People are calling Trump a fascist. What does that mean?,CNN,https://www.cnn.com/2024/10/24/politics/fascism-trump-what-matters/index.html,2024-10-24 23:42:44 UTC,people are calling trump a fascist what does that mean,politics,negative
US and Israel warn of potential attack on tourist locations in Sri Lanka,CNN,https://www.cnn.com/2024/10/23/politics/us-israel-warn-potential-attack-sri-lanka/index.html,2024-10-24 23:42:44 UTC,us and israel warn of potential attack on tourist locations in sri lanka,foreign_policy,negative
Behind CNN’s investigation on deceptive political fundraising that costs elderly donors their retirement savings,CNN,https://www.cnn.com/2024/10/22/politics/election-fundraising-donors-what-matters/index.html,2024-10-24 23:42:44 UTC,behind cnn s investigation on deceptive political fundraising that costs elderly donors their retirement savings,politics,neutral
"Fact check: Trump, on a lying spree, made at least 40 separate false claims in two Pennsylvania speeches",CNN,https://www.cnn.com/2024/10/10/politics/fact-check-trump-pennsylvania-speeches/index.html,2024-10-24 23:42:44 UTC,fact check trump on a lying spree made at least 40 separate false claims in two pennsylvania speeches,politics,negative
"Harris to deliver closing argument speech at Ellipse, site of Trump’s January 6 rally",CNN,https://www.cnn.com/2024/10/23/politics/national-mall-kamala-harris-speech/index.html,2024-10-24 23:42:44 UTC,harris to deliver closing argument speech at ellipse site of trump s january 6 rally,politics,positive
"again asks court to dismiss January 6 criminal case, saying special counsel is unconstitutional",CNN,https://www.cnn.com/2024/10/24/politics/trump-jack-smith-january-6-case/index.html,2024-10-24 23:42:44 UTC,again asks court to dismiss january 6 criminal case saying special counsel is unconstitutional,other,negative
Biden makes clear AI can’t launch nukes as he looks to harness new technology’s power,CNN,https://www.cnn.com/2024/10/24/politics/joe-biden-artificial-intelligence-nuclear-weapons/index.html,2024-10-24 23:42:44 UTC,biden makes clear ai can t launch nukes as he looks to harness technology s power,politics,positive
Key lines to understand the Kamala Harris town hall on CNN,CNN,https://www.cnn.com/2024/10/24/politics/key-lines-harris-town-hall-what-matters/index.html,2024-10-24 23:42:44 UTC,key lines to understand the kamala harris town hall on cnn,politics,positive
Justice Department reaches $100 million settlement with two companies in Baltimore bridge collapse,CNN,https://www.cnn.com/2024/10/24/politics/justice-department-settlement-baltimore-bridge-collapse/index.html,2024-10-24 23:42:44 UTC,justice department reaches 100 million settlement with two companies in baltimore bridge collapse,other,negative
"Federal agency closes investigation into RFK Jr. over dead whale carcass, saying allegation unfounded",CNN,https://www.cnn.com/2024/10/24/politics/rfk-jr-dead-whale-investigation-closed/index.html,2024-10-24 23:42:44 UTC,federal agency closes investigation into rfk jr over dead whale carcass saying allegation unfounded,economy,negative
Obama again feels the ‘fierce urgency of now’ as Trump eyes return to power,CNN,https://www.cnn.com/2024/10/25/politics/obama-harris-springsteen-election-analysis/index.html,2024-10-24 23:42:44 UTC,obama again feels the fierce urgency of now as trump eyes return to power,politics,positive
Fact check: Trump makes at least 11 false claims in foreign policy interview,CNN,https://www.cnn.com/2024/10/08/politics/fact-check-trump-false-claims-foreign-policy/index.html,2024-10-24 23:42:44 UTC,fact check trump makes at least 11 false claims in foreign policy interview,"politics,foreign_policy",negative
The House and Senate could make history this election,CNN,https://www.cnn.com/2024/10/22/politics/senate-house-election-history/index.html,2024-10-24 23:42:44 UTC,the house and senate could make history this election,politics,positive
campaign manager shared posts in 2021 saying Trump’s lies caused the violence on January 6,CNN,https://www.cnn.com/2024/10/23/politics/trump-campaign-manager-january-6/index.html,2024-10-24 23:42:44 UTC,campaign manager shared posts in 2021 saying trump s lies caused the violence on january 6,politics,negative
"KFile: Kamala Harris pledged to prosecute oil companies over emissions. Now, she’s praising their record US production",CNN,https://www.cnn.com/2024/10/15/politics/harris-oil-companies-emissions-kfile/index.html,2024-10-24 23:42:44 UTC,kfile kamala harris pledged to prosecute oil companies over emissions now she s praising their record us production,politics,positive
Trump says US is ‘like a garbage can for the world’ as he rails against illegal immigration,CNN,https://www.cnn.com/2024/10/24/politics/trump-us-garbage-can-immigration/index.html,2024-10-24 23:42:44 UTC,trump us is like a garbage can for the world as he rails against illegal immigration,politics,negative
"Explore key dates, events and deadlines for the 2024 election",CNN,https://cnn.it/3vC62PR,2024-10-24 23:42:44 UTC,explore key dates events and deadlines for the 2024 election,politics,positive
"After news of DOJ warning, Elon Musk’s super PAC didn’t announce ‘daily’ lottery winner on Wednesday",CNN,https://www.cnn.com/2024/10/24/politics/elon-musk-super-pac-lottery-winner-doj-warning/index.html,2024-10-24 23:42:44 UTC,after news of doj warning elon musk s super pac didn t announce daily lottery winner on wednesday,foreign_policy,negative
Gaza hostage and ceasefire talks are set to resume but hopes for a breakthrough before the US election are low,CNN,https://www.cnn.com/2024/10/24/politics/gaza-hostage-and-ceasefire-talks-us-election/index.html,2024-10-24 23:42:44 UTC,gaza hostage and ceasefire talks are set to resume but hopes for a breakthrough before the us election are low,politics,negative
What are your questions about the election?,CNN,https://www.cnn.com/2024/10/17/politics/election-questions-callout/index.html,2024-10-24 23:42:44 UTC,what are your questions about the election,politics,negative
Former Sports Illustrated swimsuit model says Trump groped her to show off for Jeffrey Epstein,CNN,https://www.cnn.com/2024/10/24/politics/stacey-williams-donald-trump-jeffrey-epstein/index.html,2024-10-24 23:42:44 UTC,former sports illustrated swimsuit model trump groped her to show off for jeffrey epstein,politics,negative
Michigan autoworkers see more enthusiasm for Harris — but also more sexism and racism,CNN,https://www.cnn.com/2024/10/21/politics/michigan-auto-workers-harris-trump/index.html,2024-10-24 23:42:44 UTC,michigan autoworkers see more enthusiasm for harris but also more sexism and racism,politics,negative
House GOP committee that oversees elections hired two former Trump officials involved in 2020 fake elector scheme,CNN,https://www.cnn.com/2024/10/24/politics/house-gop-committee-trump-fake-elector-scheme/index.html,2024-10-24 23:42:44 UTC,house gop committee that oversees elections hired two former trump officials involved in 2020 fake elector scheme,politics,negative
"Elon Musk’s super PAC awards $1 million prizes to 2 registered voters, despite DOJ warning",CNN,https://www.cnn.com/2024/10/25/politics/elon-musk-super-pac-winners-doj-warning/index.html,2024-10-24 23:42:44 UTC,elon musk s super pac awards 1 million prizes to 2 registered voters despite doj warning,"politics,foreign_policy",negative
Biden expected to apologize for federal government’s role in Indian boarding schools,CNN,https://www.cnn.com/2024/10/24/politics/joe-biden-apology-native-american-boarding-schools/index.html,2024-10-24 23:42:44 UTC,biden expected to apologize for federal government s role in indian boarding schools,"politics,economy",negative
Georgia election official says battleground state fended off cyberattack likely from a foreign country,CNN,https://www.cnn.com/2024/10/23/politics/georgia-election-official-cyber-attack/index.html,2024-10-24 23:42:44 UTC,georgia election official battleground state fended off cyberattack likely from a foreign country,"politics,foreign_policy",neutral
Sell the Steal: How Michael Flynn built a business and MAGA following out of election denialism,CNN,https://www.cnn.com/2024/10/24/politics/michael-flynn-election-denialism-business-maga/index.html,2024-10-24 23:42:44 UTC,sell the steal how michael flynn built a business and maga following out of election denialism,politics,positive
Weeks to Election Day. Here’s what to watch,CNN,https://www.cnn.com/2024/10/05/politics/election-day-one-month-what-matters/index.html,2024-10-24 23:42:44 UTC,weeks to election day here s what to watch,politics,positive
Democrats seize on new suggestions of Trump’s extremism in the campaign’s final stretch,CNN,https://www.cnn.com/2024/10/23/politics/trump-hitler-democratic-warnings-analysis/index.html,2024-10-24 23:42:44 UTC,democrats seize on suggestions of trump s extremism in the campaign s final stretch,politics,negative
18 million early votes and counting. Here’s what we know,CNN,https://www.cnn.com/2024/10/22/politics/early-voting-numbers-what-matters/index.html,2024-10-24 23:42:44 UTC,18 million early votes and counting here s what we know,other,positive
Trump’s former chief of staff says he fits ‘fascist’ definition and prefers ‘dictator approach’,CNN,https://www.cnn.com/2024/10/22/politics/trump-fascist-john-kelly/index.html,2024-10-24 23:42:44 UTC,trump s former chief of staff he fits fascist definition and prefers dictator approach,politics,negative
"Musk gave another $43.5M to pro-Trump PAC, but Harris leads cash race",Washington Post,https://www.washingtonpost.com/politics/2024/10/25/elon-musk-donald-trump-donation/,2024-10-24 23:42:41 UTC,musk gave another 43 5m to pro trump pac but harris leads cash race,politics,neutral
Jim Jordan Jordan subpoenas Biden-Harris admin for cost of housing illegal migrants at taxpayers' expense,Fox News Politics,https://www.foxnews.com/politics/jordan-subpoenas-biden-harris-admin-cost-housing-illegal-migrants-taxpayers-expense,2024-10-24 23:28:35 UTC,jim jordan jordan subpoenas biden harris admin for cost of housing illegal migrants at taxpayers expense,politics,negative
US Texas AG Paxton files criminal referral against DOJ from 'suspicious donations' through Democratic group,Fox News Politics,https://www.foxnews.com/us/texas-ag-paxton-files-criminal-referral-against-doj-from-suspicious-donations-through-democratic-group,2024-10-24 23:28:35 UTC,us texas ag paxton files criminal referral against doj from suspicious donations through democratic group,politics,negative
Battleground state's high court rejects GOP challenge to provisional ballot rules,Fox News Politics,https://www.foxnews.com/politics/battleground-states-high-court-rejects-gop-challenge-provisional-ballot-rules,2024-10-24 23:28:35 UTC,battleground state s high court rejects gop challenge to provisional ballot rules,politics,neutral
Intelligence report says Iran will keep trying to kill Trump regardless of election outcome,Fox News Politics,https://www.foxnews.com/politics/dni-report-iran-trying-kill-trump-election,2024-10-24 23:28:35 UTC,intelligence report iran will keep trying to kill trump regardless of election outcome,politics,negative
Elections Newsletter Fox News Politics: Harris surrogates bedeviled by gaffes,Fox News Politics,https://www.foxnews.com/politics/fox-news-politics-harris-surrogates-bedeviled-gaffes,2024-10-24 23:28:35 UTC,elections newsletter fox news politics harris surrogates bedeviled by gaffes,politics,negative
Bill Maher says Kamala Harris must convince voters she's not part of 'worst excesses of the left',Fox News Politics,https://www.foxnews.com/media/bill-maher-kamala-harris-must-convince-voters-shes-not-part-worst-excesses-left,2024-10-24 23:28:35 UTC,bill maher kamala harris must convince voters she s not part of worst excesses of the left,politics,positive
Elections Newsletter Fox News Politics: Georgia on Trump's mind,Fox News Politics,https://www.foxnews.com/politics/fox-news-politics-georgia-trumps-mind,2024-10-24 23:28:35 UTC,elections newsletter fox news politics georgia on trump s mind,politics,positive
"Kamala Harris’ closing message is unclear, Donald Trump dominates media by going off script",Fox News Politics,https://www.foxnews.com/politics/kamala-harris-closing-message-unclear-donald-trump-dominates-media-going-off-script,2024-10-24 23:28:35 UTC,kamala harris closing message is unclear donald trump dominates media by going off script,politics,negative
Democrats Dolton Mayor Tiffany Henyard will seek to arrest political opponents as she faces eviction,Fox News Politics,https://www.foxnews.com/us/dolton-mayor-tiffany-henyard-seek-arrest-political-opponents-she-faces-eviction,2024-10-24 23:28:35 UTC,democrats dolton mayor tiffany henyard will seek to arrest political opponents as she faces eviction,politics,negative
Blinken warns Israel 'should not lead a protracted campaign' against Hezbollah in Lebanon,Fox News Politics,https://www.foxnews.com/world/blinken-warns-israel-should-not-lead-protracted-campaign-against-hezbollah-lebanon,2024-10-24 23:28:35 UTC,blinken warns israel should not lead a protracted campaign against hezbollah in lebanon,"politics,foreign_policy",negative
Playing the Hitler card: Will Trump backers dismiss John Kelly’s attack?,Fox News Politics,https://www.foxnews.com/politics/playing-hitler-card-trump-backers-dismiss-john-kellys-attack,2024-10-24 23:28:35 UTC,playing the hitler card will trump backers dismiss john kelly s attack,politics,negative
"Voting Vast majority of Americans support photo ID requirement to vote, new poll says",Fox News Politics,https://www.foxnews.com/politics/vast-majority-americans-support-photo-id-requirement-vote-new-poll-says,2024-10-24 23:28:35 UTC,voting vast majority of americans support photo id requirement to vote poll,politics,neutral
"No, Trump is not literally Hitler. So what is he?",Washington Post,https://www.washingtonpost.com/politics/2024/10/24/trump-kelly-hitler/,2024-10-24 23:21:28 UTC,no trump is not literally hitler so what is he,politics,negative
Updating (and fixing) Trump’s favorite chart,Washington Post,https://www.washingtonpost.com/politics/2024/10/24/trump-biden-immigration/,2024-10-24 23:21:28 UTC,updating and fixing trump s favorite chart,politics,positive
Michigan Arabs and Muslims deeply split over supporting Harris,Washington Post,https://www.washingtonpost.com/politics/2024/10/24/kamala-harris-arab-american-muslims-michigan/,2024-10-24 23:21:28 UTC,michigan arabs and muslims deeply split over supporting harris,politics,negative
Trump backers are more primed to doubt the election than they were in 2020,Washington Post,https://www.washingtonpost.com/politics/2024/10/16/trump-backers-are-more-primed-doubt-election-than-they-were-2020/,2024-10-24 23:21:28 UTC,trump backers are more primed to doubt the election than they were in 2020,politics,negative
Biden set to apologize to Native Americans for Indian boarding schools,Washington Post,https://www.washingtonpost.com/national/investigations/,2024-10-24 23:21:28 UTC,biden set to apologize to native americans for indian boarding schools,politics,negative
