title,source,url,timestamp,cleaned_text,topics,sentiment
Mississippi’s Absentee Ballot Law Is Overturned,New York Times,https://www.nytimes.com/2024/10/25/us/mississippi-absentee-ballot-law.html,2024-10-25 15:35:07 UTC,mississippi s absentee ballot law is overturned,politics,negative
Gov. Glenn Youngkin calls federal judge's order to reinstate noncitizens to voter roll 'beyond comprehension',Fox News Politics,https://www.foxnews.com/video/6363762984112,2024-10-25 15:32:59 UTC,gov glenn youngkin calls federal judge s order to reinstate noncitizens to voter roll beyond comprehension,"politics,economy",negative
Trump responds after federal judge halts Virginia's pre-election voter roll purge: 'Blatantly un-American',Fox News Politics,https://www.foxnews.com/video/6363759877112,2024-10-25 15:27:54 UTC,trump responds after federal judge halts virginia s pre election voter roll purge blatantly un american,"politics,economy",negative
Biden administration greenlit refugee applications for members of bloodthirsty Venezuelan gang: report,Fox News Politics,https://www.foxnews.com/politics/biden-admin-greenlit-refugee-applications-members-bloodthirsty-venezuelan-gang,2024-10-25 15:27:54 UTC,biden administration greenlit refugee applications for members of bloodthirsty venezuelan gang report,politics,negative
"'Too little, too late': Former rap mogul reveals why he's endorsing Trump in scathing rebuke of Biden-Harris",Fox News Politics,https://www.foxnews.com/politics/former-rap-mogul-reveals-why-hes-endorsing-trump-scathing-rebuke-biden-harris,2024-10-25 15:27:46 UTC,too little too late former rap mogul reveals why he s endorsing trump in scathing rebuke of biden harris,politics,negative
Voter registration fraud probe involving 2500 applications confirmed by Pa. election officials,Fox News Politics,https://www.foxnews.com/politics/voter-registration-fraud-probe-involving-2500-applications-confirmed-pa-election-officials,2024-10-25 15:27:46 UTC,voter registration fraud probe involving 2500 applications confirmed by pa election officials,politics,negative
Harris-Trump showdown: VP continues to dominate this crucial campaign metric days before 2024 election,Fox News Politics,https://www.foxnews.com/politics/harris-trump-showdown-vp-continues-dominate-crucial-campaign-metric-days-before-2024-election,2024-10-25 15:27:46 UTC,harris trump showdown vp continues to dominate this crucial campaign metric days before 2024 election,politics,neutral
Top Dems demand special counsel to investigate Jared Kushner less than 2 weeks from Election Day,Fox News Politics,https://www.foxnews.com/politics/top-dems-demand-special-counsel-investigate-jared-kushner-less-than-2-weeks-from-election-day,2024-10-25 15:27:46 UTC,top dems demand special counsel to investigate jared kushner less than 2 weeks from election day,politics,negative
'The worst thing I've ever heard': Holocaust survivor blasts Harris for comparing Trump to Hitler,Fox News Politics,https://www.foxnews.com/politics/the-worst-thing-ive-ever-heard-holocaust-survivor-blasts-harris-comparing-trump-hitler,2024-10-25 15:27:46 UTC,the worst thing i ve ever heard holocaust survivor blasts harris for comparing trump to hitler,politics,negative
"Trump, Harris dead even in national poll, with just one in four saying country headed in right direction",Fox News Politics,https://www.foxnews.com/politics/trump-harris-dead-even-national-poll-just-1-4-saying-country-headed-right-direction,2024-10-25 15:27:46 UTC,trump harris dead even in national poll with just one in four saying country headed in right direction,politics,negative
Chris Christie no longer confident VP Harris will win election: 'She's had a bad 10 days',Fox News Politics,https://www.foxnews.com/media/chris-christie-no-longer-confident-vp-harris-win-election-shes-had-bad-10-days,2024-10-25 15:27:46 UTC,chris christie no longer confident vp harris will win election she s had a bad 10 days,politics,negative
Virginia governor slams 'astounding' federal ruling reinstating voting rights for alleged noncitizens,Fox News Politics,https://www.foxnews.com/media/virginia-governor-slams-astounding-federal-ruling-reinstating-voting-rights-alleged-noncitizens,2024-10-25 15:27:46 UTC,virginia governor slams astounding federal ruling reinstating voting rights for alleged noncitizens,economy,positive
Harris breaks silence after GOP leaders say anti-Trump rhetoric 'risks inviting' another assassination attempt,Fox News Politics,https://www.foxnews.com/politics/harris-breaks-silence-after-gop-leaders-say-anti-trump-rhetoric-risks-inviting-another-assassination-attempt,2024-10-25 15:27:46 UTC,harris breaks silence after gop leaders say anti trump rhetoric risks inviting another assassination attempt,politics,negative
James Carville rants about far-left's 'jacka--' language alienating voters: 'It's been a problem',Fox News Politics,https://www.foxnews.com/media/james-carville-rants-about-far-lefts-jacka-language-alienating-voters-its-been-problem,2024-10-25 15:27:46 UTC,james carville rants about far left s jacka language alienating voters it s been a problem,politics,negative
Fox News Politics: Judge orders Virginia to reinstate potential noncitizens to voter rolls,Fox News Politics,https://www.foxnews.com/politics/fox-news-politics-judge-orders-virginia-reinstate-potential-noncitizens-voter-rolls,2024-10-25 15:27:46 UTC,fox news politics judge orders virginia to reinstate potential noncitizens to voter rolls,politics,negative
Ex-Trump officials tell Americans to 'heed General Kelly's warning' Trump's a fascist,Fox News Politics,https://www.foxnews.com/politics/ex-trump-officials-tell-americans-heed-general-kellys-warning-about-trump,2024-10-25 15:27:46 UTC,ex trump officials tell americans to heed general kelly s warning trump s a fascist,"politics,foreign_policy",negative
"Trump on track for 'narrow landslide' victory, Kellyanne Conway predicts",Fox News Politics,https://www.foxnews.com/media/trump-track-narrow-landslide-victory-kellyanne-conway-predicts,2024-10-25 15:27:46 UTC,trump on track for narrow landslide victory kellyanne conway predicts,politics,negative
"Chinese hackers attempted to breach Trump, Vance cellphone data: report",Fox News Politics,https://www.foxnews.com/politics/chinese-hackers-attempted-breach-trump-vance-cellphone-data,2024-10-25 15:27:46 UTC,chinese hackers attempted to breach trump vance cellphone data report,politics,negative
The New York Times Is Looking for Flashback Contributors,New York Times,https://www.nytimes.com/2024/10/25/upshot/flashback-contributors.html,2024-10-25 15:26:18 UTC,the is looking for flashback contributors,other,negative
"Flashback: Your Weekly History Quiz, October 26, 2024",New York Times,https://www.nytimes.com/interactive/2024/10/25/upshot/flashback.html,2024-10-25 15:26:18 UTC,flashback your weekly history quiz october 26 2024,other,positive
‘Pure Hell’: The Painful Legacy of Boarding Schools for Native Americans.,New York Times,https://www.nytimes.com/2024/10/25/us/us-indian-boarding-schools-history.html,2024-10-25 15:26:12 UTC,pure hell the painful legacy of boarding schools for native americans,other,negative
Los Angeles D.A.’s Move in Menendez Case Comes Amid Tough Re-election Bid,New York Times,https://www.nytimes.com/2024/10/25/us/menendez-brothers-los-angeles-da.html,2024-10-25 15:26:12 UTC,los angeles d a s move in menendez case comes amid tough re election bid,politics,negative
"13 Ex-Trump Aides Back Kelly’s ‘Dictator’ Warning, Saying Trump Seeks ‘Absolute, Unchecked Power’",New York Times,https://www.nytimes.com/2024/10/25/us/politics/trump-officials-letter-fascist-john-kelly.html,2024-10-25 15:26:08 UTC,13 ex trump aides back kelly s dictator warning saying trump seeks absolute unchecked power,"politics,foreign_policy",negative
It’s Springsteen Season Again. Can Celebrities Give Harris a Meaningful Boost?,New York Times,https://www.nytimes.com/2024/10/25/us/politics/kamala-harris-celebrities.html,2024-10-25 15:26:08 UTC,it s springsteen season again can celebrities give harris a meaningful boost,politics,positive
Chinese Hackers Are Said to Have Targeted Phones Used by Trump and Vance,New York Times,https://www.nytimes.com/2024/10/25/us/politics/trump-vance-hack.html,2024-10-25 15:26:08 UTC,chinese hackers are to have targeted phones used by trump and vance,politics,negative
Election Officials Face Torrent of Threats as Nov. 5 Looms,New York Times,https://www.nytimes.com/2024/10/25/us/politics/election-officials-workers-threats.html,2024-10-25 15:26:08 UTC,election officials face torrent of threats as nov 5 looms,politics,negative
"In Wisconsin’s Senate Race, the Republican Highlights Baldwin’s Sexuality",New York Times,https://www.nytimes.com/2024/10/25/us/politics/wisconsin-senate-race-tammy-baldwin-sexuality.html,2024-10-25 15:26:08 UTC,in wisconsin s senate race the republican highlights baldwin s sexuality,politics,positive
"Biden Apologizes for U.S. Abuse of Indian Children, Calling It ‘a Sin on Our Soul’",New York Times,https://www.nytimes.com/2024/10/25/us/politics/biden-apology-indian-abuse.html,2024-10-25 15:26:08 UTC,biden apologizes for u s abuse of indian children calling it a sin on our soul,politics,negative
Biden Administration Floats Student Loan Relief for Borrowers Facing Hardship,New York Times,https://www.nytimes.com/2024/10/25/us/politics/student-loan-debt-hardship-biden.html,2024-10-25 15:26:08 UTC,biden administration floats student loan relief for borrowers facing hardship,politics,negative
What’s at Stake in the 2024 Election,New York Times,https://www.nytimes.com/interactive/2024/us/politics/whats-at-stake.html,2024-10-25 15:26:08 UTC,what s at stake in the 2024 election,politics,positive
The Policy Record Harris Isn’t Talking About,New York Times,https://www.nytimes.com/2024/10/25/us/politics/harris-racism-sexism-policies.html,2024-10-25 15:26:08 UTC,the policy record harris isn t talking about,politics,negative
"Middle East War Hits Home in Michigan, Threatening Slotkin in Tight Senate Race",New York Times,https://www.nytimes.com/2024/10/25/us/politics/michigan-slotkin-senate-gaza-lebanon-israel.html,2024-10-25 15:26:08 UTC,middle east war hits home in michigan threatening slotkin in tight senate race,"politics,foreign_policy",negative
Two more LA Times editorial board members resign after the paper withholds a Harris endorsement,houstonchronicle.com,https://www.houstonchronicle.com/entertainment/article/two-more-la-times-editorial-board-members-resign-19863296.php,2024-10-25 14:21:20 UTC,two more la editorial board members resign after the paper withholds a harris endorsement,politics,negative
"Editor resigns, subscribers cancel as Washington Post non-endorsement prompts crisis at Bezos paper",semafor.com,https://www.semafor.com/article/10/25/2024/editor-resign-subscribers-cancel-as-washington-post-non-endorsement-prompts-crisis-at-bezos-paper,2024-10-25 13:48:37 UTC,editor resigns subscribers cancel as washington post non endorsement prompts crisis at bezos paper,other,negative
Leonardo DiCaprio endorses Kamala Harris for president,apnews.com,https://apnews.com/article/leonardo-dicaprio-endorses-kamala-harris-election-2024-40bf7286e7219dfd59957bf28d34f578,2024-10-25 13:15:42 UTC,leonardo dicaprio endorses kamala harris for president,politics,positive
Democracy Dies In Cowardice - Jeff Bezos Kills Washington Post Endorsement days after LA Times Refuses to Endorse,theverge.com,https://www.theverge.com/2024/10/25/24279602/jeff-bezos-washington-post-kamala-harris-endorsement,2024-10-25 13:10:43 UTC,democracy dies in cowardice jeff bezos kills washington post endorsement days after la refuses to endorse,foreign_policy,negative
“This is cowardice”: Ex-editor blasts Washington Post after Jeff Bezos blocks Harris endorsement,salon.com,https://www.salon.com/2024/10/25/this-is-cowardice-ex-editor-blasts-washington-post-after-jeff-bezos-blocks-harris-endorsement/,2024-10-25 12:20:29 UTC,this is cowardice ex editor blasts washington post after jeff bezos blocks harris endorsement,"politics,foreign_policy",negative
“Extreme Danger”: Harris Earns a Stunning Endorsement Over Trump,newrepublic.com,https://newrepublic.com/post/187537/kamala-harris-donald-trump-stunning-endorsement,2024-10-25 12:02:29 UTC,extreme danger harris earns a stunning endorsement over trump,politics,positive
We endorse Kamala Harris for President of the United States,houstonchronicle.com,https://www.houstonchronicle.com/opinion/endorsements/article/kamala-harris-presidential-endorsement-2024-19829891.php,2024-10-25 11:55:16 UTC,we endorse kamala harris for president of the united states,politics,positive
"Jeff Bezos killed Washington Post endorsement of Kamala Harris, paper reports",cnbc.com,https://www.cnbc.com/2024/10/25/jeff-bezos-killed-washington-post-endorsement-of-kamala-harris-.html,2024-10-25 11:53:07 UTC,jeff bezos killed washington post endorsement of kamala harris paper reports,politics,negative
Jeff Bezos Proves He’s a Coward With Washington Post Endorsement News | The “Democracy Dies in Darkness” paper just made a pathetic decision that can only be explained by Jeff Bezos bowing to Donald Trump.,newrepublic.com,https://newrepublic.com/post/187561/washington-post-president-endorsement-harris-trump-bezos-coward,2024-10-25 11:42:55 UTC,jeff bezos proves he s a coward with washington post endorsement news the democracy dies in darkness paper just made a pathetic decision that can only be explained by jeff bezos bowing to donald trump,"politics,foreign_policy",negative
"The Washington Post opinion editor approved a Harris endorsement. A week later, the paper’s publisher killed it.",cjr.org,https://www.cjr.org/political_press/the-washington-post-opinion-editor-approved-a-harris-endorsement-a-week-later-the-papers-publisher-killed-it.php,2024-10-25 11:26:38 UTC,the washington post editor approved a harris endorsement a week later the paper s publisher killed it,politics,negative
"DAVID MARCUS: In battleground Pennsylvania, exhausted Allentown voters see this candidate surging",Fox News Politics,https://www.foxnews.com/opinion/david-marcus-battleground-pennsylvania-exhausted-allentown-voters-see-candidate-surging,2024-10-25 11:08:18 UTC,david marcus in battleground pennsylvania exhausted allentown voters see this candidate surging,politics,positive
Sen Tammy Baldwin hits back at GOP opponent's Clinton comparison: 'Actually called you deplorable',Fox News Politics,https://www.foxnews.com/politics/sen-tammy-baldwin-hits-back-gop-opponents-clinton-comparison-actually-called-you-deplorable,2024-10-25 11:08:18 UTC,sen tammy baldwin hits back at gop opponent s clinton comparison actually called you deplorable,other,negative
Kayleigh McEnany on WaPo refusing to endorse in 2024 race: What an insult to Kamala Harris,Fox News Politics,https://www.foxnews.com/video/6363752468112,2024-10-25 11:08:18 UTC,kayleigh mcenany on wapo refusing to endorse in 2024 race what an insult to kamala harris,politics,negative
New ‘RBG PAC’ Spending $19 Million From Secret Donors to Aid Trump on Abortion,New York Times,https://www.nytimes.com/2024/10/25/us/politics/trump-ruth-bader-ginsberg-abortion-ad.html,2024-10-25 11:04:29 UTC,rbg pac spending 19 million from secret donors to aid trump on abortion,politics,negative
"Struggling with mental health, many turn to AI like ChatGPT for therapy",Washington Post,https://www.washingtonpost.com/business/2024/10/25/ai-therapy-chatgpt-chatbots-mental-health/,2024-10-25 10:43:03 UTC,struggling with mental health many turn to ai like chatgpt for therapy,other,negative
"Beyonce, Taylor Swift, Barbie: ‘Girl culture’ collides with Harris campaign",Washington Post,https://www.washingtonpost.com/politics/2024/10/25/harris-girl-culture-beyonce-taylor-swift-barbie/,2024-10-25 10:43:03 UTC,beyonce taylor swift barbie girl culture collides with harris campaign,politics,negative
New report reveals massive number of illegal immigrants benefiting from Biden-Harris admin's 'quiet amnesty',Fox News Politics,https://www.foxnews.com/politics/new-report-reveals-massive-number-illegal-immigrants-benefiting-from-biden-harris-admins-quiet-amnesty,2024-10-25 10:37:34 UTC,report reveals massive number of illegal immigrants benefiting from biden harris admin s quiet amnesty,politics,positive
John Kirby speaks about long-range missile capabilities for Ukraine,Fox News Politics,https://www.foxnews.com/video/6363655276112,2024-10-25 10:37:34 UTC,john kirby speaks about long range missile capabilities for ukraine,other,positive
"Putin welcomes Iran, India, China to BRICS Summit to discuss 'new world order' to challenge the West",Fox News Politics,https://www.foxnews.com/politics/putin-welcomes-iran-india-china-brics-summit-discuss-new-world-order-challenge-west,2024-10-25 10:37:34 UTC,putin welcomes iran india china to brics summit to discuss world order to challenge the west,foreign_policy,positive
Biden admin worried costs outweigh benefits of green-lighting long-range missiles for Ukraine: US official,Fox News Politics,https://www.foxnews.com/politics/biden-admin-worried-costs-outweigh-benefits-greenlighting-long-range-missiles-ukraine-us-official,2024-10-25 10:37:34 UTC,biden admin worried costs outweigh benefits of green lighting long range missiles for ukraine us official,politics,negative
Federal agencies ordered to use ‘most powerful’ AI systems in first-ever National Security Memo on AI,Fox News Politics,https://www.foxnews.com/politics/federal-agencies-ordered-use-most-powerful-ai-systems-first-ever-national-security-memo-ai,2024-10-25 10:37:34 UTC,federal agencies ordered to use most powerful ai systems in first ever national security memo on ai,economy,negative
DHS identifies hundreds of migrants with possible ties to bloodthirsty Venezuelan gang,Fox News Politics,https://www.foxnews.com/politics/dhs-identifies-hundreds-migrants-in-us-possible-ties-bloodthirsty-venezuelan-gang,2024-10-25 10:37:34 UTC,dhs identifies hundreds of migrants with possible ties to bloodthirsty venezuelan gang,other,neutral
Migrants in Mexico say they fear Trump presidency,Fox News Politics,https://www.foxnews.com/video/6363696336112,2024-10-25 10:37:34 UTC,migrants in mexico say they fear trump presidency,politics,negative
Trump gets out the vote in Georgia,Fox News Politics,https://www.foxnews.com/video/6363661276112,2024-10-25 10:37:34 UTC,trump gets out the vote in georgia,politics,positive
'DHS Watchlist' founder says conservatives need to remove career 'radicals' from government,Fox News Politics,https://www.foxnews.com/video/6363699188112,2024-10-25 10:37:34 UTC,dhs watchlist founder conservatives need to remove career radicals from government,other,negative
'Conservative' former Ohio Gov. Bob Taft to vote for Democratic Sen. Sherrod Brown,Fox News Politics,https://www.foxnews.com/politics/conservative-former-ohio-gov-bob-taft-vote-democratic-sen-sherrod-brown,2024-10-25 10:37:30 UTC,conservative former ohio gov bob taft to vote for democratic sen sherrod brown,politics,positive
Video of Dem-aligned individual at Montana ballot box sparks 'tampering' concern from election administrator,Fox News Politics,https://www.foxnews.com/politics/video-dem-aligned-individual-montana-ballot-box-sparks-tampering-concern-from-election-administrator,2024-10-25 10:37:30 UTC,video of dem aligned individual at montana ballot box sparks tampering concern from election administrator,politics,negative
"McConnell, GOP descend on Nebraska to save Deb Fischer's endangered Senate seat",Fox News Politics,https://www.foxnews.com/politics/mcconnell-gop-descend-nebraska-save-deb-fischers-endangered-senate-seat,2024-10-25 10:37:30 UTC,mcconnell gop descend on nebraska to save deb fischer s endangered senate seat,politics,neutral
Trump's rising poll numbers help key down-ballot races: Kevin McCarthy,Fox News Politics,https://www.foxnews.com/video/6363608377112,2024-10-25 10:37:30 UTC,trump s rising poll numbers help key down ballot races kevin mccarthy,politics,positive
"Schumer, Dems pre-election report urges voters to be wary of 'misinformation' about results",Fox News Politics,https://www.foxnews.com/politics/schumer-dems-pre-election-report-urges-voters-wary-misinformation-about-results,2024-10-25 10:37:30 UTC,schumer dems pre election report urges voters to be wary of misinformation about results,"politics,foreign_policy",negative
"Anonymous GOP senator concerned about Grassley, 91, reclaiming key Judiciary Committee chair: report",Fox News Politics,https://www.foxnews.com/politics/anonymous-gop-senator-concerned-about-grassley-91-reclaiming-key-judiciary-committee-chair-report,2024-10-25 10:37:30 UTC,anonymous gop senator concerned about grassley 91 reclaiming key judiciary committee chair report,other,positive
Montana Senate race shatters spending records at $309 per registered voter,Fox News Politics,https://www.foxnews.com/politics/montana-senate-race-shatters-spending-records-309-spent-per-registered-voter,2024-10-25 10:37:30 UTC,montana senate race shatters spending records at 309 per registered voter,politics,negative
Sam Brown begins to close gap with incumbent Sen. Jacky Rosen in battleground Nevada,Fox News Politics,https://www.foxnews.com/politics/sam-brown-begins-close-gap-incumbent-sen-jacky-rosen-battleground-nevada,2024-10-25 10:37:30 UTC,sam brown begins to close gap with incumbent sen jacky rosen in battleground nevada,other,negative
"Morning Glory: Trump has the momentum, as does the Senate GOP",Fox News Politics,https://www.foxnews.com/opinion/morning-glory-trump-has-momentum-does-senate-gop,2024-10-25 10:37:30 UTC,morning glory trump has the momentum as does the senate gop,politics,positive
Vulnerable NY Republican blasts Dem challenger's progressive endorsement after moderate showing at debate,Fox News Politics,https://www.foxnews.com/politics/vulnerable-ny-republican-blasts-dem-challengers-progressive-endorsement-after-moderate-showing-debate,2024-10-25 10:37:24 UTC,vulnerable ny republican blasts dem challenger s progressive endorsement after moderate showing at debate,politics,negative
Harris praises pro-Farrakhan pastor who said gay people should feel 'uncomfortable' in their 'sin',Fox News Politics,https://www.foxnews.com/politics/harris-praises-pro-farrakhan-pastor-who-said-gay-people-should-feel-uncomfortable-sin,2024-10-25 10:37:24 UTC,harris praises pro farrakhan pastor who gay people should feel uncomfortable in their sin,politics,positive
Fox News Politics: Harris surrogates bedeviled by gaffes,Fox News Politics,https://www.foxnews.com/politics/fox-news-politics-harris-surrogates-bedeviled-gaffes,2024-10-25 10:37:24 UTC,fox news politics harris surrogates bedeviled by gaffes,politics,negative
Fox News Politics: Nearly 1 million migrants staying 'indefinitely',Fox News Politics,https://www.foxnews.com/politics/fox-news-politics-nearly-1-million-migrants-staying-indefinitely,2024-10-25 10:37:24 UTC,fox news politics nearly 1 million migrants staying indefinitely,other,negative
"'Ideological balance': Supreme Court's conservative majority to stay no matter who wins election, experts say",Fox News Politics,https://www.foxnews.com/politics/ideological-balance-supreme-courts-conservative-majority-stay-no-matter-who-wins-election-experts-say,2024-10-25 10:37:24 UTC,ideological balance supreme court s conservative majority to stay no matter who wins election experts say,politics,neutral
12 Dems join GOP lawmakers to threaten UN funding over 'ongoing hostility' to Israel,Fox News Politics,https://www.foxnews.com/politics/12-dems-join-gop-lawmakers-threaten-un-funding-over-ongoing-hostility-israel,2024-10-25 10:37:24 UTC,12 dems join gop lawmakers to threaten un funding over ongoing hostility to israel,other,negative
Socialist group in AOC district blasts police crackdown in her crime-ridden area,Fox News Politics,https://www.foxnews.com/us/socialist-group-aoc-district-blasts-police-crackdown-her-crime-ridden-area,2024-10-25 10:37:24 UTC,socialist group in aoc district blasts police crackdown in her crime ridden area,other,negative
Pentagon denies false claim that Biden-Harris admin authorized troops to use force against Americans,Fox News Politics,https://www.foxnews.com/politics/pentagon-denies-false-claim-biden-harris-admin-authorized-troops-use-force-against-americans,2024-10-25 10:37:24 UTC,pentagon denies false claim that biden harris admin authorized troops to use force against americans,politics,neutral
Caravan descending on border could preview migrant rush to sneak into US if Trump wins election,Fox News Politics,https://www.foxnews.com/politics/caravan-descending-border-could-preview-migrant-rush-sneak-us-trump-wins-election,2024-10-25 10:37:24 UTC,caravan descending on border could preview migrant rush to sneak into us if trump wins election,politics,negative
"'Ill-fated effort': McConnell was 'furious' at Rick Scott's 2022 leader bid, book says",Fox News Politics,https://www.foxnews.com/politics/ill-fated-effort-mcconnell-furious-rick-scotts-2022-leader-bid-book-says,2024-10-25 10:37:24 UTC,ill fated effort mcconnell was furious at rick scott s 2022 leader bid book,other,negative
"Trump, Harris dead even in national poll, with just 1 in 4 saying country headed in right direction",Fox News Politics,https://www.foxnews.com/politics/trump-harris-dead-even-national-poll-just-1-4-saying-country-headed-right-direction,2024-10-25 10:37:24 UTC,trump harris dead even in national poll with just 1 in 4 saying country headed in right direction,politics,negative
