title,source,url,timestamp,cleaned_text,topics,sentiment
Former Republican Rep. Fred Upton says he's 'proud' he voted for Kamala Harris,Fox News Politics,https://www.foxnews.com/politics/former-republican-rep-fred-upton-says-hes-proud-he-voted-kamala-harris,2024-10-25 10:37:24 UTC,former republican rep fred upton he s proud he voted for kamala harris,politics,positive
Fox News Politics: Georgia on Trump's mind,Fox News Politics,https://www.foxnews.com/politics/fox-news-politics-georgia-trumps-mind,2024-10-25 10:37:24 UTC,fox news politics georgia on trump s mind,politics,positive
"Alsobrooks has clear lead in Maryland Senate race, Post-UMD poll finds",Washington Post,https://www.washingtonpost.com/local/maryland/politics/,2024-10-25 10:37:05 UTC,alsobrooks has clear lead in maryland senate race post umd poll finds,politics,positive
"Harris leads among Virginia voters, Post-Schar School poll finds",Washington Post,https://www.washingtonpost.com/local/virginia/politics/,2024-10-25 10:37:05 UTC,harris leads among virginia voters post schar school poll finds,politics,positive
Washington Post Poll Archive,Washington Post,https://www.washingtonpost.com/polling/2019/05/24/washington-post-poll-archive/,2024-10-25 10:37:05 UTC,washington post poll archive,politics,negative
"Virginia voters support school cellphone bans, Post-Schar School poll finds",Washington Post,https://www.washingtonpost.com/local/education/,2024-10-25 10:37:05 UTC,virginia voters support school cellphone bans post schar school poll finds,politics,negative
"How two pollsters — one Democrat, one Republican — see the polls",Washington Post,https://www.washingtonpost.com/politics/the-briefs-newsletters/early-brief/,2024-10-25 10:37:02 UTC,how two pollsters one democrat one republican see the polls,politics,positive
Carolyn Hax: One daughter is allergic; the other ‘insists’ on bringing a dog,Washington Post,https://www.washingtonpost.com/advice/2024/10/25/carolyn-hax-allergic-dogs-sister/,2024-10-25 10:36:56 UTC,carolyn hax one daughter is allergic the other insists on bringing a dog,other,negative
Ukrainian incursion in Kursk struggles as Russians retake territory,Washington Post,https://www.washingtonpost.com/world/2024/10/25/ukraine-russia-kursk-attack/,2024-10-25 10:36:56 UTC,ukrainian incursion in kursk struggles as russians retake territory,foreign_policy,negative
Elon Musk’s Starlink is set to boom if Trump wins,Washington Post,https://www.washingtonpost.com/technology/2024/10/24/musk-trump-starlink-satellites-election/,2024-10-25 10:36:56 UTC,elon musk s starlink is set to boom if trump wins,politics,positive
needs a minute,Washington Post,https://www.washingtonpost.com/opinions/2024/10/25/kamala-harris-mistake-weakness-cnn-town-hall/,2024-10-25 10:36:56 UTC,needs a minute,other,negative
When will headlines reflect Trump’s deterioration? I answered your questions.,Washington Post,https://www.washingtonpost.com/opinions/2024/10/23/jennifer-rubin-live-chat/,2024-10-25 10:36:56 UTC,when will headlines reflect trump s deterioration i answered your questions,politics,negative
She threw a 70s-themed ‘cancerversary’ to ‘dance in death’s face’,Washington Post,https://www.washingtonpost.com/lifestyle/2024/10/25/breast-cancer-survivor-cancerversary/,2024-10-25 10:36:56 UTC,she threw a 70s themed cancerversary to dance in death s face,other,negative
U.N. says only a ‘quantum leap’ can keep global climate goals within reach,Washington Post,https://www.washingtonpost.com/climate-environment/2024/10/24/global-warming-countries-un/,2024-10-25 10:36:56 UTC,u n only a quantum leap can keep global climate goals within reach,other,negative
Israeli strike in south Lebanon kills three journalists,Washington Post,https://www.washingtonpost.com/world/2024/10/25/lebanon-strike-journalists-gaza/,2024-10-25 10:36:56 UTC,israeli strike in south lebanon kills three journalists,other,negative
"In star-studded rally, Obama and Springsteen join Harris before large crowd",Washington Post,https://www.washingtonpost.com/politics/2024/10/24/harris-obama-perry-springsteen/,2024-10-25 10:36:56 UTC,in star studded rally obama and springsteen join harris before large crowd,politics,positive
Business etiquette classes boom as people relearn how to act at work,Washington Post,https://www.washingtonpost.com/business/2024/10/24/business-etiquette-classes-boom/,2024-10-25 10:36:56 UTC,business etiquette classes boom as people relearn how to act at work,other,positive
Her teenage son killed himself after talking to a chatbot. Now she’s suing.,Washington Post,https://www.washingtonpost.com/nation/2024/10/24/character-ai-lawsuit-suicide/,2024-10-25 10:36:56 UTC,her teenage son killed himself after talking to a chatbot now she s suing,other,negative
"Armand Gamache is on edge in Louise Penny’s new novel, ‘The Grey Wolf’",Washington Post,https://www.washingtonpost.com/books/2024/10/25/louise-penny-gamache-grey-wolf-review/,2024-10-25 10:36:56 UTC,armand gamache is on edge in louise penny s novel the grey wolf,other,positive
America’s political realignment is catching Democrats flat-footed,Washington Post,https://www.washingtonpost.com/opinions/2024/10/25/politics-realignment-democrats-race-class/,2024-10-25 10:36:56 UTC,america s political realignment is catching democrats flat footed,politics,negative
Need advice? Carolyn Hax is taking your questions.,Washington Post,https://www.washingtonpost.com/advice/2024/10/25/live-chat-carolyn-hax/,2024-10-25 10:36:56 UTC,need advice carolyn hax is taking your questions,other,negative
A Civil War soldier didn’t have a tombstone. Two teens just got him one.,Washington Post,https://www.washingtonpost.com/lifestyle/2024/10/25/civil-war-veteran-tombstone-teens/,2024-10-25 10:36:56 UTC,a civil war soldier didn t have a tombstone two teens just got him one,foreign_policy,negative
"Does the truth still count for anything? In 11 days, we’ll find out.",Washington Post,https://www.washingtonpost.com/opinions/2024/10/25/hurricane-helene-aftermath-fema-trump/,2024-10-25 10:36:56 UTC,does the truth still count for anything in 11 days we ll find out,other,negative
"In one Wisconsin county, undecided voters reflect unease with Trump and Harris",Washington Post,https://www.washingtonpost.com/politics/2024/10/25/wisconsin-swing-state-undecided-voters-trump-harris/,2024-10-25 10:36:56 UTC,in one wisconsin county undecided voters reflect unease with trump and harris,politics,negative
How we came to part ways on the Appalachian Trail,Washington Post,https://www.washingtonpost.com/opinions/2024/10/25/appalachian-trail-parting-hike-parenthood/,2024-10-25 10:36:56 UTC,how we came to part ways on the appalachian trail,other,positive
Drought levels across the U.S. are notably high for this time of year,Washington Post,https://www.washingtonpost.com/weather/2024/10/24/us-drought-dry-conditions-east-maps/,2024-10-25 10:36:56 UTC,drought levels across the u s are notably high for this time of year,other,negative
"There’s hope for North Koreans, if America acts. Just look at me.",Washington Post,https://www.washingtonpost.com/opinions/2024/10/25/congress-reauthorize-north-korea-human-rights/,2024-10-25 10:36:56 UTC,there s hope for north koreans if america acts just look at me,other,positive
Satellite images show major expansion at Russian site with secret bioweapons past,Washington Post,https://www.washingtonpost.com/national-security/interactive/2024/russia-biological-chemical-weapons-laboratory-expansion/,2024-10-25 10:36:56 UTC,satellite images show major expansion at russian site with secret bioweapons past,foreign_policy,neutral
AI is transforming weather forecasting. Is the U.S. falling behind?,Washington Post,https://www.washingtonpost.com/weather/2024/10/25/ai-weather-models-helene-milton-forecasts/,2024-10-25 10:36:56 UTC,ai is transforming weather forecasting is the u s falling behind,other,positive
Do you know where Trump and Harris stand on foreign policy? Take our quiz.,Washington Post,https://www.washingtonpost.com/world/interactive/2024/trump-harris-foreign-policy-quiz/,2024-10-25 10:36:56 UTC,do you know where trump and harris stand on foreign policy take our quiz,"politics,foreign_policy",negative
How long can you stand on one foot? The answer may predict your fall risk.,Washington Post,https://www.washingtonpost.com/wellness/2024/10/23/balance-loss-sign-aging/,2024-10-25 10:36:56 UTC,how long can you stand on one foot the answer may predict your fall risk,other,negative
This huge lithium mine shows the trade-offs of the clean-energy transition,Washington Post,https://www.washingtonpost.com/climate-environment/2024/10/24/lithium-mine-nevada-tiehms-buckwheat/,2024-10-25 10:36:56 UTC,this huge lithium mine shows the trade offs of the clean energy transition,economy,negative
A tense ‘Saturday Night Live’ for election 2024,Washington Post,https://www.washingtonpost.com/entertainment/tv/2024/10/23/saturday-night-live-2024-election-political-impersonations/,2024-10-25 10:36:56 UTC,a tense saturday night live for election 2024,politics,positive
Al Jazeera rejects Israeli claim that its journalists have militant links,Washington Post,https://www.washingtonpost.com/world/2024/10/24/al-jazeera-idf-accuses-militant-hamas-journalists/,2024-10-25 10:36:56 UTC,al jazeera rejects israeli claim that its journalists have militant links,other,positive
Why a popular theory about climate disasters may be wrong,Washington Post,https://www.washingtonpost.com/climate-environment/interactive/2024/billion-dollar-disasters-climate-change-economy/,2024-10-25 10:36:56 UTC,why a popular theory about climate disasters may be wrong,other,negative
Striking workers’ pension demand reflects longing for a bygone era,Washington Post,https://www.washingtonpost.com/business/2024/10/25/pensions-boeing/,2024-10-25 10:36:56 UTC,striking workers pension demand reflects longing for a bygone era,other,neutral
People are used to seeing death. Why were TMZ’s Liam Payne photos too much?,Washington Post,https://www.washingtonpost.com/opinions/2024/10/25/tmz-liam-payne-death/,2024-10-25 10:36:56 UTC,people are used to seeing death why were tmz s liam payne photos too much,other,negative
How soon will we have flying taxis? What to know after the FAA ruling.,Washington Post,https://www.washingtonpost.com/technology/2024/10/24/flying-air-taxis-electric-faa-aircraft/,2024-10-25 10:36:56 UTC,how soon will we have flying taxis what to know after the faa ruling,other,negative
A new Washington influence industry is making millions from sanctions,Washington Post,https://www.washingtonpost.com/business/interactive/2024/us-sanctions-lobbying-money-washington-lebanon-venezuela/,2024-10-25 10:36:56 UTC,a washington influence industry is making millions from sanctions,other,positive
Trump and Harris on the issues: A guide for undecided voters,Washington Post,https://www.washingtonpost.com/opinions/2024/10/25/trump-harris-issues-guide-policies-satire/,2024-10-25 10:36:56 UTC,trump and harris on the issues a guide for undecided voters,politics,positive
Trashed trails and gridlock: Leaf-peepers are overrunning fall destinations,Washington Post,https://www.washingtonpost.com/travel/2024/10/24/leaf-peeping-tourists-closures-vermont-new-hampshire/,2024-10-25 10:36:56 UTC,trashed trails and gridlock leaf peepers are overrunning fall destinations,other,negative
Pharmacy benefit managers are under fire. What do their lobbyists say?,Washington Post,https://www.washingtonpost.com/politics/2024/10/25/pharmacy-benefit-managers-are-under-fire-what-do-their-lobbyists-say/,2024-10-25 10:36:56 UTC,pharmacy benefit managers are under fire what do their lobbyists say,other,negative
forgets to hide her abortion radicalism,Washington Post,https://www.washingtonpost.com/opinions/2024/10/25/harris-abortion-choice-election-doctor/,2024-10-25 10:36:56 UTC,forgets to hide her abortion radicalism,other,negative
"Get to know nebbiolo, the grape behind some of Italy’s best wines",Washington Post,https://www.washingtonpost.com/food/2024/10/24/nebbiolo-wine-barolo-barbaresco/,2024-10-25 10:36:56 UTC,get to know nebbiolo the grape behind some of italy s best wines,other,positive
Erik Wemple answers your questions on the media,Washington Post,https://www.washingtonpost.com/opinions/2024/10/14/erik-wemple-media-live-chat/,2024-10-25 10:36:56 UTC,erik wemple answers your questions on the media,other,positive
"What would Trump do to Social Security? Your election and economy questions, answered.",Washington Post,https://www.washingtonpost.com/business/2024/10/24/harris-trump-economic-plans-questions-answers/,2024-10-25 10:36:56 UTC,what would trump do to social security your election and economy questions answered,"politics,economy",negative
On political endorsement,Washington Post,https://www.washingtonpost.com/opinions/2024/10/25/washington-post-endorsement/,2024-10-25 10:36:56 UTC,on political endorsement,politics,positive
A college football fan’s ‘crazy’ goal: See 100 games in person this season,Washington Post,https://www.washingtonpost.com/sports/2024/10/25/michael-barker-college-football-fan/,2024-10-25 10:36:56 UTC,a college football fan s crazy goal see 100 games in person this season,other,positive
"For Wizards, an opening night packed with silver linings. Get used to it.",Washington Post,https://www.washingtonpost.com/sports/2024/10/24/wizards-celtics-opening-night/,2024-10-25 10:36:56 UTC,for wizards an opening night packed with silver linings get used to it,other,positive
"Stung by the backlash, Ted Leonsis is trying to win back Washington",Washington Post,https://www.washingtonpost.com/sports/2024/10/25/ted-leonsis-washington-capitals-wizards-mystics/,2024-10-25 10:36:56 UTC,stung by the backlash ted leonsis is trying to win back washington,other,negative
Skillet pork with kale and grapes leans sweet and sour the Italian way,Washington Post,https://www.washingtonpost.com/food/2024/10/24/pork-tenderloin-quick-skillet-dinner-kale/,2024-10-25 10:36:56 UTC,skillet pork with kale and grapes leans sweet and sour the italian way,other,negative
Ask Sahaj: Mother-in-law talks to me like I’m ‘the help’,Washington Post,https://www.washingtonpost.com/advice/2024/10/24/ask-sahaj-mom-in-law-the-help/,2024-10-25 10:36:56 UTC,ask sahaj mother in law talks to me like i m the help,other,positive
Judge permanently blocks law that banned most Ohio abortions. Here’s what to know.,Washington Post,https://www.washingtonpost.com/nation/2024/10/24/ohio-abortion-court-ruling-ban/,2024-10-25 10:36:56 UTC,judge permanently blocks law that banned most ohio abortions here s what to know,other,negative
"Lies, intrigue, lawsuits: The last battle for a ‘cursed’ giant emerald",Washington Post,https://www.washingtonpost.com/world/2024/10/25/bahia-emerald-brazil/,2024-10-25 10:36:56 UTC,lies intrigue lawsuits the last battle for a cursed giant emerald,other,negative
A man opened a can of tuna on a flight. The internet gasped.,Washington Post,https://www.washingtonpost.com/travel/2024/10/25/tuna-fish-plane-etiquette-tiktok/,2024-10-25 10:36:56 UTC,a man opened a can of tuna on a flight the internet gasped,other,neutral
Going full expat is complicated and expensive. There’s an easier way.,Washington Post,https://www.washingtonpost.com/business/2024/10/22/digital-nomad-tips-money/,2024-10-25 10:36:56 UTC,going full expat is complicated and expensive there s an easier way,other,negative
"Jack Jones, hitmaking nightclub and ‘Love Boat’ singer, dies at 86",Washington Post,https://www.washingtonpost.com/obituaries/2024/10/24/jack-jones-singer-love-boat-dead-obituary/,2024-10-25 10:36:56 UTC,jack jones hitmaking nightclub and love boat singer dies at 86,other,negative
Planning for a better recovery after running a fall marathon,Washington Post,https://www.washingtonpost.com/wellness/2024/10/25/marathon-recovery-strategies/,2024-10-25 10:36:56 UTC,planning for a better recovery after running a fall marathon,other,negative
Why Harris’s pitch to Muslim and Arab American voters is failing,Washington Post,https://www.washingtonpost.com/opinions/2024/10/25/harris-muslim-arab-michigan-support-voters-election/,2024-10-25 10:36:56 UTC,why harris s pitch to muslim and arab american voters is failing,politics,negative
A gorgeous manuscript at a Smithsonian museum shows the brilliance of medieval Persia,Washington Post,https://www.washingtonpost.com/dc-md-va/2024/10/23/great-mongol-shahnama-nmaa/,2024-10-25 10:36:56 UTC,a gorgeous manuscript at a smithsonian museum shows the brilliance of medieval persia,other,positive
"D.C. Council member Vincent C. Gray says he has dementia, won’t cast votes",Washington Post,https://www.washingtonpost.com/dc-md-va/2024/10/24/vince-gray-dc-council-dementia/,2024-10-25 10:36:56 UTC,d c council member vincent c gray he has dementia won t cast votes,other,negative
"For ‘Perfect Couple’ author Elin Hilderbrand, book organization is optional",Washington Post,https://www.washingtonpost.com/books/interactive/2024/elin-hilderbrand-bookshelf-perfect-couple-author-nantucket/,2024-10-25 10:36:56 UTC,for perfect couple author elin hilderbrand book organization is optional,other,negative
Is Israel carrying out de facto ethnic cleansing?,Washington Post,https://www.washingtonpost.com/world/2024/10/25/israel-ethnic-cleansing-gaza-settlements/,2024-10-25 10:36:56 UTC,is israel carrying out de facto ethnic cleansing,other,negative
Chains remove onions from menus amid E. coli outbreak linked to McDonald’s,Washington Post,https://www.washingtonpost.com/health/2024/10/24/e-coli-onion-recall-fast-food/,2024-10-25 10:36:56 UTC,chains remove onions from menus amid e coli outbreak linked to mcdonald s,other,negative
The high-pressure world of moving priceless museum art,Washington Post,https://www.washingtonpost.com/entertainment/art/2024/10/25/art-movers-museums/,2024-10-25 10:36:56 UTC,the high pressure world of moving priceless museum art,other,positive
"Biden offers student loan relief for hardships, despite ongoing litigation",Washington Post,https://www.washingtonpost.com/education/2024/10/25/biden-student-loan-forgiveness-financial-hardship/,2024-10-25 10:36:56 UTC,biden offers student loan relief for hardships despite ongoing litigation,politics,neutral
Gaza cease-fire talks set to resume; Iran braces for Israeli retaliation,Washington Post,https://www.washingtonpost.com/world/2024/10/25/israel-iran-war-news-gaza-hamas-lebanon/,2024-10-25 10:36:56 UTC,gaza cease fire talks set to resume iran braces for israeli retaliation,other,negative
Nonprofit bashed by Musk disputes his unfounded election meddling claims,Washington Post,https://www.washingtonpost.com/politics/2024/10/24/nonprofit-bashed-by-musk-disputes-his-unfounded-election-meddling-claims/,2024-10-25 10:36:56 UTC,nonprofit bashed by musk disputes his unfounded election meddling claims,politics,negative
Poop statue appears on the National Mall to ‘honor’ Jan. 6 rioters,Washington Post,https://www.washingtonpost.com/dc-md-va/2024/10/24/dc-poop-statue-jan-6-insurrection-national-mall/,2024-10-25 10:36:56 UTC,poop statue appears on the national mall to honor jan 6 rioters,other,negative
College football Week 9 preview: Texas A&M may be building something,Washington Post,https://www.washingtonpost.com/sports/2024/10/25/college-football-games-to-watch/,2024-10-25 10:36:56 UTC,college football week 9 preview texas a m may be building something,other,positive
Grieving One Direction fans return to where they last met — online,Washington Post,https://www.washingtonpost.com/technology/2024/10/24/liam-payne-one-direction-fans-online-grief/,2024-10-25 10:36:56 UTC,grieving one direction fans return to where they last met online,other,neutral
Cate Blanchett and Guy Maddin on their absurd new comedy about the G-7,Washington Post,https://www.washingtonpost.com/entertainment/movies/2024/10/25/cate-blanchett-rumours-guy-maddin/,2024-10-25 10:36:56 UTC,cate blanchett and guy maddin on their absurd comedy about the g 7,other,positive
D.C.-area forecast: Bright skies and rain-free days continue for now,Washington Post,https://www.washingtonpost.com/weather/2024/10/25/dc-area-forecast-nice-friday/,2024-10-25 10:36:56 UTC,d c area forecast bright skies and rain free days continue for now,other,positive
Visiting New York’s island of the dead,Washington Post,https://www.washingtonpost.com/travel/2024/10/22/new-york-tours-hart-island/,2024-10-25 10:36:56 UTC,visiting s island of the dead,other,positive
One of America’s last wild places: Alaska’s Arctic National Wildlife Refuge,Washington Post,https://www.washingtonpost.com/climate-environment/interactive/2024/arctic-national-wildlife-refuge-oil/,2024-10-25 10:36:56 UTC,one of america s last wild places alaska s arctic national wildlife refuge,other,positive
White House orders Pentagon and intel agencies to increase use of AI,Washington Post,https://www.washingtonpost.com/technology/2024/10/24/white-house-ai-nation-security-memo/,2024-10-25 10:36:56 UTC,white house orders pentagon and intel agencies to increase use of ai,other,negative
Water fueled Asheville’s flourishing breweries. Then it ravaged them.,Washington Post,https://www.washingtonpost.com/food/2024/10/24/asheville-breweries-hurricane-helene-flood-water-recovery/,2024-10-25 10:36:56 UTC,water fueled asheville s flourishing breweries then it ravaged them,other,negative
A scaredy-cat’s guide to Universal’s Halloween Horror Nights,Washington Post,https://www.washingtonpost.com/travel/2024/10/24/universal-halloween-horror-nights-2024-review/,2024-10-25 10:36:56 UTC,a scaredy cat s guide to universal s halloween horror nights,other,positive
Gas prices are barreling toward a 3-year low as election nears,Washington Post,https://www.washingtonpost.com/business/2024/10/25/gas-prices-election-harris-trump/,2024-10-25 10:36:56 UTC,gas prices are barreling toward a 3 year low as election nears,"politics,foreign_policy",negative
She was arrested 24 years ago for eating a fry on the Metro. She’s outraged that child arrests persist.,Washington Post,https://www.washingtonpost.com/dc-md-va/2024/10/24/child-arrest-french-fry-girl-metro/,2024-10-25 10:36:56 UTC,she was arrested 24 years for eating a fry on the metro she s outraged that child arrests persist,other,negative
Soccer Mommy turned down the noise. She needs you to hear these words.,Washington Post,https://www.washingtonpost.com/entertainment/music/2024/10/25/soccer-mommy-sophie-allison-evergreen/,2024-10-25 10:36:56 UTC,soccer mommy turned down the noise she needs you to hear these words,other,negative
A medieval saga told of a man thrown in a well. Scientists found him.,Washington Post,https://www.washingtonpost.com/science/2024/10/25/man-found-well-iceland-saga/,2024-10-25 10:36:56 UTC,a medieval saga told of a man thrown in a well scientists found him,other,positive
"L.A. DA requests resentencing for Menendez brothers, opening path to release",Washington Post,https://www.washingtonpost.com/nation/2024/10/24/menendez-brothers-resentencing-los-angeles/,2024-10-25 10:36:56 UTC,l a da requests resentencing for menendez brothers opening path to release,other,positive
Asking Eric: My ex-wife is lying about me to our kids. They believe her.,Washington Post,https://www.washingtonpost.com/advice/2024/10/25/asking-eric-ex-wife-lies-kids/,2024-10-25 10:36:56 UTC,asking eric my ex wife is lying about me to our kids they believe her,other,neutral
‘My Name Is Alfred Hitchcock’ is devious genius,Washington Post,https://www.washingtonpost.com/entertainment/movies/2024/10/25/my-name-alfred-hitchcock-documentary/,2024-10-25 10:36:56 UTC,my name is alfred hitchcock is devious genius,other,positive
"Judge sides with federal regulators, blocks luxury fashion merger",Washington Post,https://www.washingtonpost.com/business/2024/10/24/tapestry-capri-merger-blocked/,2024-10-25 10:36:56 UTC,judge sides with federal regulators blocks luxury fashion merger,economy,neutral
The best spooky tales to read this season,Washington Post,https://www.washingtonpost.com/books/2024/10/25/scary-stories-hitchcock-halloween/,2024-10-25 10:36:56 UTC,the best spooky tales to read this season,other,positive
D.C. United cuts ties with all its goalkeepers amid roster overhaul,Washington Post,https://www.washingtonpost.com/sports/2024/10/25/dc-united-roster-ally-mackay/,2024-10-25 10:36:56 UTC,d c united cuts ties with all its goalkeepers amid roster overhaul,other,negative
A history of Opus Dei — and the conspiracy theories around it,Washington Post,https://www.washingtonpost.com/books/2024/10/23/opus-dei-book-gore-review/,2024-10-25 10:36:56 UTC,a history of opus dei and the conspiracy theories around it,other,positive
"and Iran champion close ties, but influence is limited",Washington Post,https://www.washingtonpost.com/world/2024/10/25/china-iran-middle-east-conflict/,2024-10-25 10:36:56 UTC,and iran champion close ties but influence is limited,other,negative
Cooking chat: Is iodized salt needed in your diet?,Washington Post,https://www.washingtonpost.com/food/2024/10/23/questions-recipe-cooking-advice/,2024-10-25 10:36:56 UTC,cooking chat is iodized salt needed in your diet,other,negative
DOJ reaches $100 million settlement with ship owner in Baltimore bridge collapse,Washington Post,https://www.washingtonpost.com/dc-md-va/2024/10/24/doj-settlement-baltimore-bridge-collapse-ship-owner/,2024-10-25 10:36:56 UTC,doj reaches 100 million settlement with ship owner in baltimore bridge collapse,other,negative
Work Advice: More on contractors who overstep their role,Washington Post,https://www.washingtonpost.com/business/2024/10/24/work-advice-federal-contractor-guidelines/,2024-10-25 10:36:56 UTC,work advice more on contractors who overstep their role,other,neutral
